vendor,product,iot,kev,1d,1d_uniq_ip,7d,30d,90d,history,cve,total,last_seen
Meta,React Server Components,True,True,38211,65.0,31900,32092,38810,{},CVE-2025-55182,1855252,2026-02-07 13:05:04.306376
Citrix,Citrix NetScaler,True,True,5645,80.0,5777,7152,4743,{},CVE-2025-5777,444062,2026-02-07 13:05:04.197400
Cisco,Cisco IOS XE,True,True,4503,232.0,2810,2974,3286,{},CVE-2023-20198,2052015,2026-02-07 13:05:04.267462
Check Point,Check Point Security Gateway,True,True,3070,16.0,3150,1378,1748,{},CVE-2024-24919,665741,2026-02-07 13:05:04.282474
Ivanti,"Endpoint Manager Mobile (EPMM), formerly MobileIron Core",True,True,2724,20.0,6409,6409,6409,{},CVE-2026-1281,37163,2026-02-07 13:05:04.340494
Apache,Struts,True,True,2277,1.0,2277,2277,2277,"{'21/12/2024': {'connections': 2277, 'uniq_ips': 1}}",CVE-2024-53677,2277,2024-12-21 12:39:56.606715
Ivanti,"Endpoint Manager Mobile (EPMM), formerly MobileIron Core",True,True,1870,3.0,465,611,639,{},CVE-2025-4427,314184,2026-02-06 13:16:16.452462
Huawei,Huawei Home Gateway HG532,True,True,1513,336.0,1421,1940,2260,{},CVE-2017-17215,7447483,2026-02-07 13:05:04.231861
LB-LINK,"LB-LINK BL-AC1900_2.0, LB-LINK BL-WR9000, LB-LINK BL-X26, LB-LINK BL-LTE300",True,True,1424,5.0,764,344,1295,{},CVE-2023-26801,1503086,2026-02-07 13:05:04.310550
PHPUnit - Sebastian Bergmann,PHPUnit,True,True,1358,208.0,1509,2121,1950,{},CVE-2017-9841,6112674,2026-02-07 13:05:04.311983
Apache,Apache HTTP Server,True,True,1303,223.0,1278,1137,1026,{},CVE-2021-42013,416702,2026-02-07 13:05:04.201700
Belkin,Wemo,True,True,1171,227.0,502,594,527,{},CVE-2019-12780,334071,2026-02-07 13:05:04.332542
Draytek,"Vigor3900, Vigor2960, Vigor300B",True,True,1142,211.0,265,167,86,{},CVE-2020-15415,27033,2026-02-07 13:05:04.330558
Ivanti,Ivanti CSA,True,True,1104,19.0,279,245,274,{},CVE-2024-8963,157957,2026-02-07 13:05:04.358152
Apache,Log4j,True,True,908,54.0,1039,987,2178,{},CVE-2021-44228,2346948,2026-02-07 13:05:04.380233
Geoserver,Geoserver,True,True,887,1.0,1618,1607,1617,{},CVE-2024-36401,979947,2026-02-07 13:05:04.364312
ASUS,GT-AC2900,True,True,846,4.0,925,800,974,{},CVE-2021-32030,679120,2026-02-07 13:05:04.203186
Ivanti,"Endpoint Manager Mobile (EPMM), formerly MobileIron Core",True,True,717,16.0,835,569,416,{},CVE-2023-35081,97590,2026-02-07 13:05:04.312973
Schneider Electric,Schneider Electric U.Motion Builder,True,True,714,1.0,714,714,714,{},CVE-2018-7841,714,2025-11-25 12:56:15.378919
Palo Alto Networks,PAN-OS,True,True,711,20.0,263,288,401,{},CVE-2025-0108,213468,2026-02-07 13:05:04.283708
Ivanti,Ivanti Secure Connect and Policy Secure,True,True,667,17.0,259,484,876,{},CVE-2024-21887,682761,2026-02-07 13:05:04.363896
Microsoft,Exchange,True,True,657,487.0,702,689,675,{},CVE-2022-41082,182541,2026-02-07 13:05:04.219150
Metabase,Metabase,True,True,567,135.0,498,610,619,{},CVE-2023-38646,380388,2026-02-07 13:05:04.378523
NETGEAR,NETGEAR DGN2200,True,True,496,1.0,250,170,128,{},CVE-2017-6334,876,2026-01-24 02:10:29.289882
Microsoft,Exchange,True,True,482,14.0,293,299,347,{},CVE-2021-26855,211665,2026-02-07 13:05:04.334164
D-Link,DCS-930L,True,True,480,1.0,242,162,122,{},CVE-2016-11021,1177,2026-01-24 02:10:29.256202
JetBrains,TeamCity,True,True,420,4.0,119,182,433,{},CVE-2024-27198,630757,2026-02-07 13:05:04.267859
Apache,OFBiz,True,True,388,3.0,94,43,27,{},CVE-2011-3600,37480,2026-02-07 13:05:04.269284
Atlassian,Confluence,True,True,362,93.0,103,435,475,{},CVE-2021-26084,1839113,2026-02-07 13:05:04.238303
Palo Alto Networks,PAN-OS,True,True,350,3.0,223,88,105,{},CVE-2024-0012,84641,2026-02-07 13:05:04.258864
Realtek,Realtek SDK,True,True,329,298.0,388,506,484,{},CVE-2014-8361,818575,2026-02-07 13:05:04.351594
Zyxel,Eir D1000,True,True,324,293.0,323,338,453,{},CVE-2016-10372,167529,2026-02-07 13:05:04.214179
Dasan,Dasan GPON Home Router,True,True,323,285.0,388,377,516,{},CVE-2018-10562,305417,2026-02-06 13:16:16.414063
Netgear,Netgear DGN1000,True,True,316,293.0,329,225,218,{},CVE-2024-12847,2789,2026-02-07 13:05:04.198629
Totolink,Totolink N150RT,True,True,315,1.0,315,315,315,"{'20/10/2025': {'connections': 315, 'uniq_ips': 1}}",CVE-2025-3987,315,2025-10-20 12:54:08.035732
QNAP,QNAP NAS devices running Photo Station,True,True,311,6.0,236,156,183,{},CVE-2019-7192,167610,2026-02-07 13:05:04.269487
TBK,TBK DVR-4104/DVR-4216,True,True,299,5.0,249,692,830,{},CVE-2024-3721,319376,2026-02-06 13:16:16.269948
Zyxel/Billion,"ZyXEL P660HN-T1A v1, ZyXEL P660HN-T1A v2, Billion 5200W-T",True,True,298,15.0,357,1815,1754,{},CVE-2017-18368,331708,2026-02-07 13:05:04.210236
Linksys,Linksys E-Series,True,True,273,51.0,164,110,110,{},CVE-2025-34037,650,2026-02-07 13:05:04.230032
TP-Link,TP-Link Archer AX21,True,True,254,3.0,70,130,273,{},CVE-2023-1389,1121376,2026-02-07 13:05:04.362686
AirLink101,AirLink101 SkyIPCam1620W,True,True,253,1.0,253,253,253,"{'20/10/2025': {'connections': 253, 'uniq_ips': 1}}",CVE-2015-2280,253,2025-10-20 12:54:07.947659
Ignite Realtime,Openfire,True,True,250,1.0,250,250,250,{},CVE-2023-32315,2664,2025-12-30 02:10:47.273054
Apache,Axis2,True,True,244,4.0,76,78,62,{},CVE-2010-0219,69209,2026-02-07 13:05:04.294430
Tenda,Tenda G103,True,True,232,1.0,232,232,232,"{'20/10/2025': {'connections': 232, 'uniq_ips': 1}}",CVE-2023-27076,232,2025-10-20 12:54:08.070101
Seagate,BlackArmor NAS,True,True,209,9.0,113,181,141,{},CVE-2014-3206,332598,2026-02-06 13:16:16.283534
Cleo,"Cleo Harmony, VLTrader and LexiCom",True,True,186,1.0,186,111,111,{},CVE-2024-50623,717,2026-01-07 02:12:33.156127
QNAP,QNAP Music Station,True,True,181,1.0,267,272,501,{},CVE-2023-45038,17354,2026-02-07 13:05:04.311584
D-Link,"D-Link DIR-645, DAP-1522 revB, DAP-1650 revB, DIR-880L, DIR-865L, DIR-860L revA, DIR-860L revB DIR-815 revB, DIR-300 revB, DIR-600 revB, DIR-645, TEW-751DR, TEW-733GR",True,True,169,164.0,216,213,213,{},CVE-2015-2051,104962,2026-02-06 13:16:16.267399
Shenzhen TVT,CCTV-DVR (rebranded by multiple vendors),True,True,132,129.0,146,94,91,{},CVE-2025-34036,1289,2026-02-07 13:05:04.340310
Tuoshi/Dionlink,Tuoshi/Dionlink LT15D 4G Wi-Fi,True,True,121,1.0,274,666,828,{},CVE-2024-53944,25161,2026-02-06 13:16:16.449057
GitLab,GitLab CE/EE,True,True,115,2.0,244,244,244,{},CVE-2021-22205,662,2026-01-18 12:54:10.853895
Apache,Cocoon,True,True,114,1.0,36,16,21,{},CVE-2020-11991,30817,2026-01-27 13:06:28.050795
Genexis,Genexis PLATINUM 4410,True,True,107,1.0,107,308,299,"{'05/01/2026': {'connections': 107, 'uniq_ips': 1}}",CVE-2021-29003,2990,2026-01-05 13:01:40.021237
ZTE,"ZTE F460,F660",True,True,106,2.0,54,12,7,{},CVE-2014-2321,1145,2026-02-02 13:16:42.894872
Vacron,Network Video Recorder (NVR),True,True,103,98.0,124,94,91,{},CVE-2025-34043,702,2026-02-07 13:05:04.198239
Synacor,Zimbra Collaboration Suite,True,True,100,9.0,516,709,730,{},CVE-2022-37042,991715,2026-02-07 13:05:04.188996
Netgear,NETGEAR R/D Series Routers,True,True,92,89.0,97,101,97,{},CVE-2016-6277,20839,2026-02-02 13:16:42.881084
Commvault,CommCell,True,True,87,1.0,38,22,19,{},CVE-2021-34993,20782,2026-01-27 13:06:27.874036
Ivanti,"Endpoint Manager Mobile (EPMM), formerly MobileIron Core",True,True,87,10.0,363,266,316,{},CVE-2023-35078,415887,2026-02-06 13:16:16.335817
Cisco,Cisco RV320/RV325,True,True,84,55.0,200,136,88,{},CVE-2019-1653,26444,2026-02-06 13:16:16.416200
Progress,MOVEit Transfer,True,True,83,1.0,83,83,83,"{'24/10/2025': {'connections': 83, 'uniq_ips': 1}}",CVE-2024-5806,1012,2025-10-24 12:54:46.674460
D-Link,D-Link DIR-816/DIR-816A2,True,True,81,1.0,81,81,81,"{'10/10/2024': {'connections': 81, 'uniq_ips': 1}}",CVE-2021-39509,81,2024-10-10 12:43:46.553857
jQueryFileTree,jQueryFileTree,True,True,80,1.0,28,18,19,{},CVE-2017-1000170,30949,2026-01-27 13:06:27.962431
Apache,OFBiz,True,True,80,5.0,52,38,45,{},CVE-2024-45507,8079,2026-02-02 13:16:42.806268
GLPI,GLPI,True,True,68,1.0,24,17,34,{},CVE-2025-24799,2188,2026-02-02 13:16:42.869528
Apache,ActiveMQ,True,True,65,6.0,41,67,48,{},CVE-2016-3088,68846,2026-02-07 13:05:04.223289
Synacor,Zimbra Collaboration Suite,True,True,60,2.0,31,19,17,{},CVE-2013-7091,68786,2026-02-06 13:16:16.384935
Synacor,Zimbra Collaboration Suite,True,True,58,3.0,91,424,280,"{'06/02/2026': {'connections': 58, 'uniq_ips': 3}}",CVE-2019-9670,431570,2026-02-06 13:16:16.278816
Dahua,Dahua Intelligent Cloud Gateway Registration Management Platform,True,True,57,5.0,22,25,25,{},CVE-2025-34059,115,2026-02-06 13:16:16.388496
NETGEAR/NUUO,"NETGEAR ReadyNAS Surveillance, NUUO NVRmini, NUUO NVRsolo",True,True,56,4.0,47,99,78,{},CVE-2016-5674,103665,2026-02-07 13:05:04.345454
Byzoro,Byzoro Smart S85F Management Platform,True,True,56,1.0,56,56,56,{},CVE-2023-5683,56,2025-07-23 02:21:28.153396
Atlassian,Confluence,True,True,56,3.0,67,212,215,{},CVE-2023-22527,331678,2026-02-06 13:16:16.280754
Tongda,Tongda OA,True,True,55,1.0,55,55,55,{},CVE-2023-5285,55,2025-07-23 02:21:28.089562
PrestaShop,Posthemes - Static Footer module for PrestaShop,True,True,55,1.0,55,55,55,{},CVE-2023-30194,55,2025-07-23 02:21:28.198357
Schneider Electric,SpaceLogic C-Bus Home Controller (5200WHC2),True,True,55,1.0,34,15,18,{},CVE-2022-34753,12984,2026-01-27 13:06:27.896402
Apache,OFBiz,True,True,54,1.0,20,13,22,{},CVE-2024-45195,6353,2026-01-27 13:06:27.965683
TRENDnet,TRENDnet TEW-652BRP,True,True,51,1.0,51,51,51,"{'13/10/2024': {'connections': 51, 'uniq_ips': 1}}",CVE-2023-0611,51,2024-10-13 12:40:14.968297
CyberPanel,CyberPanel,True,True,50,2.0,50,36,36,{},CVE-2024-51567,4422,2025-12-30 12:58:50.660347
APsystems,Altenergy Power Control Software,True,True,50,5.0,62,42,33,{},CVE-2023-28343,11510,2026-02-02 13:16:42.895498
Hikvision,Hikvision Web Server,True,True,46,3.0,36,49,77,{},CVE-2021-36260,266334,2026-02-07 13:05:04.351998
Apache,Druid,True,True,44,2.0,25,24,49,{},CVE-2021-25646,60899,2026-02-07 13:05:04.184602
ASUS,ASUSWRT,True,True,44,1.0,44,44,44,"{'16/05/2025': {'connections': 44, 'uniq_ips': 1}}",CVE-2018-20334,95,2025-05-16 12:51:53.679090
Terramaster,TOS,True,True,43,1.0,43,43,43,{},CVE-2018-13350,43,2025-07-23 02:21:28.216865
TRENDnet,TRENDnet TEW-411BRPplus,True,True,42,1.0,42,42,22,{},CVE-2023-51833,256,2026-01-24 02:10:29.325662
Draytek,"Draytek Vigor3900, Vigor2960, Vigor300B",True,True,41,1.0,41,41,41,"{'13/10/2024': {'connections': 41, 'uniq_ips': 1}}",CVE-2020-10826,41,2024-10-13 12:40:14.988179
Wifi-soft,Wifi-soft Unibox,True,True,41,1.0,41,41,41,{},CVE-2019-3495,41,2025-07-23 02:21:28.254409
Cisco,Cisco RV320/RV325,True,True,41,1.0,41,41,41,"{'13/10/2024': {'connections': 41, 'uniq_ips': 1}}",CVE-2019-1652,41,2024-10-13 12:40:14.946179
Shenzhen Sixun Software,Sixun Shanghui 7 Group Business Management System 7,True,True,40,1.0,40,40,40,{},CVE-2025-4281,40,2025-07-23 02:21:28.193212
Apache,Unomi,True,True,40,3.0,51,80,69,{},CVE-2020-13942,41162,2026-02-07 13:05:04.346634
Totolink,Totolink N600R,True,True,40,1.0,40,40,40,{},CVE-2022-28908,40,2025-07-23 02:21:28.105047
Apache,OFBiz,True,True,38,2.0,36,74,77,{},CVE-2021-26295,86732,2026-02-07 13:05:04.352608
Totolink,Totolink A810R,True,True,38,1.0,38,38,38,{},CVE-2025-28137,38,2025-07-23 02:21:28.133222
Guralp,Guralp MAN-EAM-0003,True,True,37,1.0,25,14,20,{},CVE-2022-38840,1238,2026-01-27 13:06:28.040006
Cisco,Cisco ISE and ISE-PIC,True,True,37,1.0,37,30,23,{},CVE-2025-20281,1658,2026-01-24 02:10:29.236927
SonicWall,SonicWall GMS and Analytics,True,True,37,5.0,62,46,41,{},CVE-2023-34133,14859,2026-02-02 13:16:42.800601
Oracle,Oracle Weblogic Server,True,True,36,3.0,39,76,52,{},CVE-2020-14882,44531,2026-02-06 13:16:16.306576
kw199711,smanga,True,True,36,1.0,36,36,36,{},CVE-2024-34193,36,2025-07-23 02:21:28.158616
Sonatype,Nexus Repository Manager,True,True,35,3.0,52,65,53,{},CVE-2019-7238,41857,2026-02-06 13:16:16.296798
Apache,ShenYu,True,True,32,2.0,26,35,30,{},CVE-2021-37580,17358,2026-02-07 13:05:04.298343
Oracle,Oracle Weblogic Server,True,True,31,2.0,9,21,611,{},CVE-2017-10271,112400,2026-02-07 13:05:04.370047
Atlassian,Confluence,True,True,30,3.0,1178,1649,2170,{},CVE-2022-26134,13175458,2026-02-07 13:05:04.192379
Ruijie Networks,Ruijie RG-UAC Application Management Gateway,True,True,30,2.0,65,49,48,{},CVE-2023-7304,2051,2026-02-07 13:05:04.379339
D-Link,D-Link DIR-600M,True,True,30,5.0,50,67,51,{},CVE-2019-13101,4492,2026-02-06 13:16:16.333458
Apache,Tapestry,True,True,28,2.0,23,41,34,{},CVE-2021-27850,32365,2026-02-07 13:05:04.196304
Apache,OFBiz,True,True,27,1.0,15,20,21,{},CVE-2023-50968,25920,2026-02-07 13:05:04.288320
F5,BIG-IP,True,True,27,3.0,43,106,150,{},CVE-2021-22986,123555,2026-02-07 13:05:04.348050
ownCloud,ownCloud,True,True,27,2.0,16,24,36,{},CVE-2023-49103,196991,2026-02-07 13:05:04.224896
D-Link,"D-Link DNS-320, DNS-320LW, DNS-325 and DNS-340L",True,True,25,5.0,125,132,171,{},CVE-2024-10914,43683,2026-02-02 13:16:42.853703
Apache,APISIX,True,True,25,2.0,26,40,42,{},CVE-2022-24112,21576,2026-02-07 13:05:04.215626
Apache,Flink,True,True,24,2.0,10,46,31,{},CVE-2020-17519,55227,2026-02-07 13:05:04.288104
Totolink,Totolink Realtek SDK based routers,True,True,24,4.0,44,49,30,{},CVE-2019-19825,21833,2026-02-06 13:16:16.279404
ttimot24,HorizontCMS,True,True,24,1.0,24,24,24,"{'14/07/2025': {'connections': 24, 'uniq_ips': 1}}",CVE-2020-27387,24,2025-07-14 12:56:16.340971
Wordpress,Wordpress WooCommerce Help Scout WordPress plugin,True,True,24,4.0,72,47,33,{},CVE-2021-24212,1003,2026-02-02 13:16:42.911974
Cockpit,Cockpit,True,True,23,2.0,49,136,100,{},CVE-2020-35131,123041,2026-02-06 13:16:16.324118
TerraMaster,TOS,True,True,23,2.0,48,102,110,{},CVE-2020-35665,153470,2026-02-06 13:16:16.445810
D-Link,DIR-868L/DIR-817LW,True,True,22,4.0,33,51,45,{},CVE-2019-17506,45529,2026-02-06 13:16:16.279756
Oracle,Oracle Weblogic Server,True,True,22,2.0,67,125,95,{},CVE-2019-2725,133211,2026-02-06 13:16:16.446012
D-Link,"D-Link DNS-320L, DNS-325, DNS-327L and DNS-340L",True,True,21,5.0,36,27,26,{},CVE-2024-3273,21135,2026-02-02 13:16:42.815940
YouPHPTube,YouPHPTube Encoder,True,True,21,2.0,46,99,82,{},CVE-2019-5128,80217,2026-02-06 13:16:16.340114
Zimbra,Zimbra Collaboration Suite,True,True,21,2.0,54,1455,656,{},CVE-2020-7796,798960,2026-02-06 13:16:16.334475
SAP,"NetWeaver Application Server ABAP, SAP NetWeaver Application Server Java, ABAP Platform, SAP Content Server 7.53 and SAP Web Dispatcher",True,True,20,3.0,31,25,19,{},CVE-2022-22536,691,2026-02-02 13:16:42.919047
Laravel,Ignition,True,True,20,4.0,37,50,106,{},CVE-2021-3129,220783,2026-02-07 13:05:04.264292
Telesquare,Telesquare SDT-CW3B1,True,True,20,1.0,129,116,117,{},CVE-2021-46422,43081,2026-02-06 13:16:16.314022
VMware,VMware Workspace ONE Access,True,True,20,4.0,27,26,26,"{'05/02/2026': {'connections': 20, 'uniq_ips': 4}}",CVE-2022-22956,79,2026-02-02 13:16:42.762995
Draytek,"Draytek Vigor2960, Vigor3900, Vigor300B",True,True,20,2.0,107,113,62,{},CVE-2020-8515,56266,2026-02-06 13:16:16.381444
Citrix,Citrix ADC and Citrix Gateway,True,True,19,6.0,45,93,149,{},CVE-2023-4966,355204,2026-02-06 13:16:16.347105
pgAdmin,pgAdmin 4,True,True,19,4.0,37,74,64,{},CVE-2024-9014,16190,2026-02-06 13:16:16.448028
vBulletin,vBulletin,True,True,19,2.0,31,51,38,{},CVE-2020-12720,31600,2026-02-06 13:16:16.289913
NETGEAR,"WN604, WN802Tv2, WNAP210v2, WNAP320, WNDAP350, WNDAP360, and WNDAP660",True,True,19,2.0,34,76,195,{},CVE-2016-1555,118062,2026-02-07 13:05:04.197826
WSO2,"WSO2 API Manager, API Microgateway",True,True,19,2.0,33,42,34,{},CVE-2020-24589,37653,2026-02-06 13:16:16.330599
Nette,Nette,True,True,19,1.0,19,6,6,"{'22/12/2025': {'connections': 19, 'uniq_ips': 1}}",CVE-2020-15227,1286,2025-12-22 12:57:04.152142
rConfig,rConfig,True,True,19,2.0,36,73,56,{},CVE-2020-13638,66782,2026-02-06 13:16:16.384307
Likeshop,Likeshop,True,True,19,5.0,33,26,28,{},CVE-2024-0352,3914,2026-02-02 13:16:42.817203
TerraMaster,TOS,True,True,18,2.0,32,63,51,{},CVE-2020-15568,59021,2026-02-06 13:16:16.313432
Apache,ColdFusion,True,True,18,2.0,35,60,53,{},CVE-2018-15961,51645,2026-02-06 13:16:16.256024
Linear,eMerge E3-Series,True,True,18,2.0,47,88,77,{},CVE-2019-7256,61488,2026-02-07 13:05:04.301426
Comodo,Comodo UTM Firewall,True,True,18,2.0,37,67,52,{},CVE-2018-17431,36067,2026-02-06 13:16:16.359968
IncomCMS,IncomCMS,True,True,18,2.0,32,58,46,{},CVE-2020-29597,49594,2026-02-06 13:16:16.335449
YouPHPTube,YouPHPTube Encoder,True,True,18,2.0,30,60,56,{},CVE-2019-5127,70435,2026-02-06 13:16:16.418039
Linksys,RE6500 Series,True,True,18,2.0,29,45,40,{},CVE-2020-35713,37859,2026-02-06 13:16:16.430451
OpenMRS,OpenMRS,True,True,18,2.0,36,46,42,{},CVE-2018-19276,4956,2026-02-06 13:16:16.274851
Cisco,Cisco Prime Infrastructure (PI) and Cisco Evolved Programmable Network (EPN),True,True,18,2.0,34,62,52,{},CVE-2019-1821,45792,2026-02-06 13:16:16.328645
LG,NAS N1A1,True,True,18,2.0,36,47,46,{},CVE-2018-14839,51138,2026-02-06 13:16:16.438420
YouPHPTube,YouPHPTube Encoder,True,True,18,2.0,43,102,91,{},CVE-2019-5129,80433,2026-02-06 13:16:16.332330
Western Digital,MyCloud NAS,True,True,18,2.0,35,71,48,{},CVE-2016-10108,35874,2026-02-06 13:16:16.377292
Citrix,Citrix SD-WAN and NetScaler SD-WAN,True,True,18,2.0,33,64,55,{},CVE-2019-12990,76133,2026-02-06 13:16:16.292367
Palo Alto Networks,PAN-OS,True,True,18,2.0,35,88,62,{},CVE-2017-15944,55599,2026-02-06 13:16:16.429044
Seowon Intech,"Seowon SLC-130, SLR-120S",True,True,18,2.0,31,41,44,{},CVE-2020-17456,52164,2026-02-06 13:16:16.432650
Ruckus,Ruckus vRioT,True,True,18,2.0,31,55,41,{},CVE-2020-26879,4005,2026-02-06 13:16:16.250412
Monitorr,Monitorr,True,True,18,2.0,29,62,58,{},CVE-2023-26775,66110,2026-02-06 13:16:16.441519
Intellian,Intellian Aptus Web,True,True,18,2.0,31,52,41,{},CVE-2020-7980,40878,2026-02-06 13:16:16.288345
Ericsson,CodeChecker,True,True,18,3.0,33,44,53,{},CVE-2024-10081,10780,2026-02-06 13:16:16.385327
WAVLINK,WAVLINK WN575A4 and WN579X3,True,True,18,2.0,31,41,39,{},CVE-2020-13117,33028,2026-02-06 13:16:16.331360
Netsweeper,Netsweeper,True,True,18,2.0,34,63,53,{},CVE-2020-13167,46320,2026-02-06 13:16:16.452645
VMware,VMware View Planner 4.x,True,True,18,2.0,23,46,42,{},CVE-2021-21978,37076,2026-02-06 13:16:16.418928
VMware,"Workspace ONE Access, Identity Manager and vRealize Automation",True,True,18,5.0,15,32,23,{},CVE-2022-31656,10298,2026-02-06 13:16:16.415806
Mirko Böer Software Development,SuperWebMailer,True,True,18,2.0,31,55,45,{},CVE-2020-11546,36545,2026-02-06 13:16:16.348928
Cisco,Cisco Smart Licensing Utility (CSLU),True,True,18,3.0,31,46,54,{},CVE-2024-20439,2488,2026-02-06 13:16:16.403374
SAP,NetWeaver AS JAVA (LM Configuration Wizard),True,True,18,2.0,30,46,34,{},CVE-2020-6287,35728,2026-02-06 13:16:16.368200
Wordpress,Wordpress Chop Slider plugin,True,True,18,2.0,32,56,39,{},CVE-2020-11530,31722,2026-02-06 13:16:16.250591
Roundcube,Roundcube Webmail,True,True,18,2.0,42,94,62,{},CVE-2020-12641,6396,2026-02-06 13:16:16.443611
CSE Bookstore,CSE Bookstore,True,True,18,2.0,30,59,39,{},CVE-2020-36112,34135,2026-02-06 13:16:16.396425
Barco/AWIND,Barco/AWIND OEM,True,True,17,2.0,34,41,43,{},CVE-2019-3929,34313,2026-02-06 13:16:16.369219
Weaver,Weaver E-Office,True,True,17,1.0,43,52,51,{},CVE-2023-2648,18676,2026-02-06 13:16:16.249633
F5,BIG-IP,True,True,17,1.0,17,12,14,{},CVE-2016-5700,678,2026-02-07 13:05:04.350569
Apache,CouchDB,True,True,17,2.0,34,65,44,{},CVE-2017-12635,53271,2026-02-06 13:16:16.320590
OpenDreamBox,Plugin WebAdmin,True,True,17,2.0,48,119,118,{},CVE-2017-14135,304554,2026-02-07 13:05:04.310352
vBulletin,vBulletin,True,True,17,2.0,37,130,166,{},CVE-2020-17496,132218,2026-02-07 13:05:04.222602
PrestaShop,Attribute Wizard addon for PrestaShop,True,True,17,2.0,37,70,47,{},CVE-2018-10942,43019,2026-02-06 13:16:16.345169
WeiPHP,WeiPHP,True,True,17,4.0,8,8,8,{},CVE-2020-20300,17,2026-02-02 13:16:42.934003
Citrix,Citrix SD-WAN and NetScaler SD-WAN,True,True,17,2.0,33,42,42,{},CVE-2019-12986,69265,2026-02-06 13:16:16.268435
PrimeFaces,PrimeTek,True,True,17,2.0,36,65,106,{},CVE-2017-1000486,51962,2026-02-06 13:16:16.294240
Wordpress,Wordpress Plugin drag-and-drop-multiple-file-upload-contact-form-7,True,True,17,2.0,32,65,63,{},CVE-2020-12800,56124,2026-02-06 13:16:16.266233
Oracle,Oracle Weblogic Server,True,True,17,2.0,36,64,55,{},CVE-2018-2894,57327,2026-02-06 13:16:16.394365
Citrix,Citrix SD-WAN and NetScaler SD-WAN,True,True,17,2.0,46,93,95,{},CVE-2019-12987,249621,2026-02-06 13:16:16.290336
VMware,vCenter,True,True,17,1.0,32,47,40,{},CVE-2021-21985,38529,2026-02-06 13:16:16.435425
nostromo,nhttpd,True,True,17,2.0,30,53,42,{},CVE-2019-16278,41517,2026-02-06 13:16:16.425535
JFrog,Artifactory,True,True,17,2.0,29,41,36,{},CVE-2019-9733,33040,2026-02-06 13:16:16.293436
MLflow,MLflow,True,True,17,1.0,63,65,62,{},CVE-2023-1177,28720,2026-02-06 13:16:16.367186
Daylight Studio,FUEL CMS,True,True,17,2.0,36,71,48,{},CVE-2018-16763,40158,2026-02-06 13:16:16.435002
Wordpress,Wordpress Oturia Smart Google Code Inserter plugin,True,True,17,2.0,37,46,35,{},CVE-2018-3810,51415,2026-02-06 13:16:16.350914
Citrix,Citrix NetScaler Console,True,True,17,3.0,36,79,66,{},CVE-2024-6235,2951,2026-02-06 13:16:16.430032
HPE,HPE Smart Update Manager (SUM),True,True,17,2.0,32,63,42,{},CVE-2020-7136,3626,2026-02-06 13:16:16.455302
Atlassian,Confluence,True,True,17,2.0,40,60,70,{},CVE-2019-3396,119321,2026-02-06 13:16:16.275886
Hitachi Ventara,Pentaho Business Analytics,True,True,16,2.0,19,12,16,{},CVE-2021-31602,12007,2026-01-24 02:10:29.392691
Wordpress,Wordpress Media Library Assistant plugin,True,True,16,1.0,119,88,119,{},CVE-2023-4634,37380,2026-02-06 13:16:16.257537
Wordpress,Wordpress Gift Voucher plugin,True,True,16,2.0,34,65,42,{},CVE-2018-16159,34330,2026-02-06 13:16:16.454528
Mitel,MiCollab,True,True,16,1.0,63,55,81,{},CVE-2024-41713,26356,2026-02-06 13:16:16.431026
VMware,Aria Operations for Networks,True,True,16,1.0,38,41,40,{},CVE-2023-20887,18709,2026-02-06 13:16:16.315656
Webmin,Webmin,True,True,16,2.0,36,52,42,{},CVE-2019-15107,44804,2026-02-06 13:16:16.315855
Cassia,Cassia Gateway,True,True,16,1.0,119,103,98,{},CVE-2023-31446,25324,2026-02-06 13:16:16.293627
FSMLabs,TimeKeeper,True,True,16,1.0,124,103,95,{},CVE-2023-31465,36929,2026-02-06 13:16:16.377704
Viessmann,Vitogate 300 BN/MB,True,True,16,1.0,41,41,43,{},CVE-2023-5222,11406,2026-02-06 13:16:16.391716
Atlassian,Crowd/Crowd Data Center,True,True,16,2.0,36,59,49,{},CVE-2019-11580,60865,2026-02-06 13:16:16.275277
Spring,Spring Framework,True,True,16,2.0,32,44,48,"{'06/02/2026': {'connections': 16, 'uniq_ips': 6}}",CVE-2022-22965,42190,2026-02-06 13:16:16.451891
F5,BIG-IP,True,True,16,2.0,19,41,68,{},CVE-2023-46747,49297,2026-02-07 13:05:04.299534
Six Apart (Movable Type),Movable Type,True,True,16,2.0,28,59,46,{},CVE-2021-20837,36824,2026-02-06 13:16:16.366103
Cisco,HyperFlex HX,True,True,16,2.0,31,41,39,{},CVE-2021-1497,39329,2026-02-06 13:16:16.312619
GLPI (teclib),GLPI,True,True,16,1.0,41,46,69,{},CVE-2022-35914,38747,2026-02-06 13:16:16.402197
D-Link,D-Link Central WiFi Manager CWM(100),True,True,16,2.0,35,42,36,{},CVE-2019-13372,3283,2026-02-06 13:16:16.350137
Drupal,Drupal,True,True,15,3.0,33,65,222,{},CVE-2018-7600,65947,2026-02-07 13:05:04.379738
OpenMetadata,OpenMetadata,True,True,15,1.0,95,117,155,{},CVE-2024-28255,37787,2026-02-06 13:16:16.404259
Apache,OFBiz,True,True,15,1.0,32,36,36,{},CVE-2023-49070,12155,2026-02-06 13:16:16.326146
PrestaShop,NDK Design for PrestaShop,True,True,15,1.0,31,35,35,{},CVE-2023-46347,9836,2026-02-06 13:16:16.369024
Dell,Dell EMC Avamar Server and Dell EMC Integrated Data Protection Appliance,True,True,15,2.0,35,85,186,{},CVE-2018-1217,67758,2026-02-07 13:05:04.308217
Ivanti,"Endpoint Manager Mobile (EPMM), formerly MobileIron Core",True,True,15,7.0,80,97,100,{},CVE-2023-35082,126731,2026-02-06 13:16:16.256231
Viessmann,Vitogate 300 BN/MB,True,True,15,1.0,32,33,55,{},CVE-2023-45852,12485,2026-02-06 13:16:16.260738
PaperCut,PaperCut MF/NG,True,True,15,1.0,35,51,52,{},CVE-2023-27350,35951,2026-02-06 13:16:16.327580
vBulletin,vBulletin,True,True,15,1.0,36,39,39,{},CVE-2023-25135,14118,2026-02-06 13:16:16.326563
D-Link,D-Link DAR-8000-10,True,True,15,1.0,31,36,36,{},CVE-2023-4542,7635,2026-02-06 13:16:16.394177
DCN (Digital China Networks),DCBI-Netlog-LAB,True,True,15,1.0,37,42,42,{},CVE-2023-26802,3706,2026-02-06 13:16:16.416834
SaltStack,Salt,True,True,15,2.0,69,107,369,{},CVE-2020-16846,118046,2026-02-07 13:05:04.327222
Atlassian,JIRA,True,True,15,4.0,25,25,22,{},CVE-2019-11581,20881,2026-02-02 13:16:42.787431
LG,SuperSign CMS,True,True,15,2.0,136,178,137,{},CVE-2018-17173,7009,2026-02-07 13:05:04.181407
Wordpress,Wordpress Jordy Meow AI Engine: ChatGPT Chatbot plugin,True,True,15,1.0,31,36,35,{},CVE-2023-51409,2417,2026-02-06 13:16:16.262492
CONTEC,SolarView Compact,True,True,15,1.0,35,36,41,{},CVE-2023-23333,15045,2026-02-06 13:16:16.359417
CONTEC,SolarView Compact,True,True,15,1.0,41,42,36,{},CVE-2023-29919,10650,2026-02-06 13:16:16.357451
CONTEC,SolarView Compact,True,True,15,1.0,41,41,43,{},CVE-2022-40881,15359,2026-02-06 13:16:16.301610
Zoho,ManageEngine (multiple products),True,True,15,1.0,36,40,46,{},CVE-2022-47966,14136,2026-02-06 13:16:16.251549
Totolink,Totolink A3700R,True,True,15,1.0,32,32,39,{},CVE-2023-46574,11683,2026-02-06 13:16:16.336022
Dahua,Smart Park Management,True,True,15,1.0,38,37,40,{},CVE-2023-3836,11789,2026-02-06 13:16:16.318426
IBM,Aspera Faspex,True,True,15,1.0,29,33,41,{},CVE-2022-47986,13564,2026-02-06 13:16:16.294843
Wordpress,Wordpress HTML5 Video Player plugin,True,True,15,1.0,29,39,54,{},CVE-2024-1061,11601,2026-02-06 13:16:16.311935
Wordpress,Wordpress IWS - Geo Form Fields plugin,True,True,15,1.0,39,41,39,{},CVE-2022-4117,13084,2026-02-06 13:16:16.263583
Wordpress,Wordpress WooCommerce Checkout Field Manager plugin,True,True,15,1.0,37,39,51,{},CVE-2022-4328,16987,2026-02-06 13:16:16.393055
JEECG,jeecg-boot,True,True,15,1.0,34,39,34,{},CVE-2023-34659,11004,2026-02-06 13:16:16.247889
SysAid,SysAid On-Premise,True,True,15,1.0,38,42,48,{},CVE-2023-47246,19220,2026-02-06 13:16:16.310681
Shanghai Fanwei Network Technology,Panwei e-office,True,True,15,2.0,66,48,48,{},CVE-2025-34046,204,2026-02-07 13:05:04.177271
Wordpress,Wordpress Fontsy plugin,True,True,15,1.0,35,39,38,{},CVE-2022-4447,12511,2026-02-06 13:16:16.271919
Sitecore,"Experience Manager, Experience Platform, and Experience Commerce",True,True,15,1.0,34,38,43,{},CVE-2023-35813,13896,2026-02-06 13:16:16.335233
Ivanti,Avalanche,True,True,15,1.0,35,80,57,{},CVE-2023-32563,19679,2026-02-06 13:16:16.291958
Control iD,Control iD iDSecure,True,True,15,1.0,30,37,32,{},CVE-2023-6329,907,2026-02-06 13:16:16.272294
Totolink,Totolink A3700R,True,True,15,1.0,33,35,40,{},CVE-2023-52028,14195,2026-02-06 13:16:16.309880
CloudPanel,CloudPanel,True,True,15,1.0,32,36,47,{},CVE-2023-35885,21152,2026-02-06 13:16:16.310300
D-Link,D-Link DAR-7000 and DAR-8000,True,True,15,1.0,17,36,60,{},CVE-2023-5148,10412,2026-02-06 13:16:16.448869
WAGO,WAGO products (multiple),True,True,15,1.0,35,39,42,{},CVE-2023-1698,16058,2026-02-06 13:16:16.454347
FIT2CLOUD,KubePi,True,True,15,1.0,36,42,36,{},CVE-2024-36111,10319,2026-02-06 13:16:16.355170
Progress,MOVEit Transfer,True,True,15,1.0,31,38,41,{},CVE-2023-36934,12791,2026-02-06 13:16:16.440710
Wordpress,Wordpress Easy Digital Downloads plugin,True,True,15,1.0,25,34,35,{},CVE-2023-23489,13311,2026-02-06 13:16:16.342809
JEECG,jeecg-boot,True,True,15,1.0,31,34,45,{},CVE-2023-4450,8920,2026-02-06 13:16:16.292572
GeoServer,GeoServer,True,True,15,1.0,35,90,74,{},CVE-2023-43795,39127,2026-02-06 13:16:16.308675
D-Link,D-Link D-View 8,True,True,15,1.0,31,39,35,{},CVE-2023-5074,10516,2026-02-06 13:16:16.333672
Wordpress,Wordpress Update Backup Restore & Monitoring plugin,True,True,15,5.0,15,15,15,"{'18/03/2025': {'connections': 15, 'uniq_ips': 5}}",CVE-2024-12209,15,2025-03-18 12:49:07.855121
Sophos,Sophos Web Appliance,True,True,15,1.0,34,38,44,{},CVE-2023-1671,14357,2026-02-06 13:16:16.298647
Apache,Arrow,True,True,15,1.0,29,32,36,{},CVE-2023-47248,5081,2026-02-06 13:16:16.345369
Honeywell,Honeywell PM43,True,True,15,1.0,34,39,41,{},CVE-2023-3710,10835,2026-02-06 13:16:16.305026
Ollama,Ollama,True,True,15,1.0,63,49,78,{},CVE-2024-37032,20090,2026-02-06 13:16:16.454093
Arcserve,Arcserve Unified Data Protection (UDP),True,True,15,1.0,49,43,39,{},CVE-2023-26258,2170,2026-02-06 13:16:16.344415
Chamilo,Chamilo,True,True,15,1.0,103,82,46,{},CVE-2023-34960,12749,2026-02-06 13:16:16.307674
Microsoft,SharePoint,True,True,15,1.0,40,53,51,{},CVE-2023-29357,16125,2026-02-06 13:16:16.432065
MASA CMS,MASA CMS,True,True,14,1.0,33,39,50,{},CVE-2024-32640,9769,2026-02-06 13:16:16.265846
Yonyou,NC BeanShell,True,True,14,1.0,78,62,62,{},CVE-2025-34039,298,2026-02-07 13:05:04.348662
WBCE,WBCE CMS,True,True,14,1.0,32,36,34,{},CVE-2023-39796,11038,2026-02-06 13:16:16.292848
Apache,OFBiz,True,True,14,1.0,37,34,35,{},CVE-2023-51467,13663,2026-02-06 13:16:16.311533
ZoneMinder,ZoneMinder,True,True,14,1.0,46,37,49,{},CVE-2024-43360,3215,2026-02-06 13:16:16.261490
TP-Link,TP-Link Archer C20,True,True,14,1.0,39,38,55,{},CVE-2024-57049,4456,2026-02-06 13:16:16.303458
JEECG,jeecg-boot,True,True,14,1.0,36,33,34,{},CVE-2023-1454,12608,2026-02-06 13:16:16.331560
R-HUB,TurboMeeting,True,True,14,1.0,44,40,58,{},CVE-2024-38289,13655,2026-02-06 13:16:16.311735
NetAlertX,NetAlertX,True,True,14,1.0,42,37,49,{},CVE-2024-48766,4170,2026-02-06 13:16:16.370447
Wordpress,Wordpress File Upload plugin,True,True,14,1.0,34,32,46,{},CVE-2024-9047,3856,2026-02-06 13:16:16.440311
SPIP,SPIP,True,True,14,1.0,25,31,45,{},CVE-2024-7954,6716,2026-02-06 13:16:16.373375
FlexPaper (Flowpaper),FlexPaper (Flowpaper),True,True,14,2.0,34,79,63,{},CVE-2018-11686,15694,2026-02-07 13:05:04.350970
ForgeRock,ForgeRock Access Manager,True,True,14,5.0,15,28,30,{},CVE-2021-35464,12456,2026-02-06 13:16:16.392099
Wordpress,Wordpress JoomSport plugin,True,True,14,1.0,31,38,36,{},CVE-2022-4050,12635,2026-02-06 13:16:16.355395
Ruijie Networks,NBR,True,True,14,2.0,41,29,29,{},CVE-2020-36870,162,2026-02-07 13:05:04.262467
D-Link,"D-Link DIR-615, DIR-655C, DIR-825, DIR-835, DIR-855L, DIR-866L, DIR-652, DIR-862L, DHP-1565, DAP-1533",True,True,14,2.0,78,125,220,{},CVE-2019-16920,133407,2026-02-07 13:05:04.332746
Sophos,Sophos Mobile,True,True,14,1.0,24,36,38,{},CVE-2022-3980,13410,2026-02-06 13:16:16.395543
Spring,Spring Data Commons,True,True,14,1.0,34,78,61,{},CVE-2018-1273,77971,2026-02-07 13:05:04.344159
Wordpress,Wordpress NotificationX plugin,True,True,14,1.0,30,39,51,{},CVE-2024-1698,10972,2026-02-06 13:16:16.259321
Palo Alto Networks,Palo Alto Expedition,True,True,14,1.0,37,34,34,{},CVE-2024-9463,6220,2026-02-06 13:16:16.309073
JEECG,jeecg-boot,True,True,14,1.0,49,46,57,{},CVE-2024-48307,16611,2026-02-06 13:16:16.449680
Wordpress,Wordpress PayPlus Payment Gateway plugin,True,True,14,1.0,36,35,50,{},CVE-2024-6205,6602,2026-02-06 13:16:16.356408
Ivanti,Ivanti EPM,True,True,14,1.0,37,64,58,{},CVE-2024-13161,8578,2026-02-06 13:16:16.345733
Qlik,Qlik Sense,True,True,14,1.0,18,24,21,{},CVE-2023-41265,2276,2026-02-06 13:16:16.344800
ColumbiaSoft,Document Locator,True,True,14,1.0,32,40,41,{},CVE-2023-5830,10466,2026-02-06 13:16:16.440909
Patton,SmartNode SN200,True,True,14,1.0,32,35,32,{},CVE-2023-41109,9614,2026-02-06 13:16:16.334279
Fortra,GoAnywhere MFT,True,True,14,8.0,16,58,40,{},CVE-2024-0204,31465,2026-02-06 13:16:16.400187
Aviatrix,Aviatrix Network Controller,True,True,13,1.0,38,37,48,{},CVE-2024-50603,7044,2026-02-06 13:16:16.433037
AimStack,Aim,True,True,13,1.0,56,45,71,{},CVE-2024-6396,16714,2026-02-06 13:16:16.316611
Tenda,Tenda G1 and G3,True,True,13,1.0,13,13,13,"{'09/06/2025': {'connections': 13, 'uniq_ips': 1}}",CVE-2021-27692,13,2025-06-09 12:53:37.709067
Wordpress,Wordpress WP Query Console plugin,True,True,13,1.0,39,36,61,{},CVE-2024-50498,4758,2026-02-06 13:16:16.400009
Ivanti,Ivanti EPM,True,True,13,1.0,34,60,58,{},CVE-2024-13159,11291,2026-02-06 13:16:16.372145
plentico,plenti,True,True,13,1.0,32,35,36,{},CVE-2024-49380,781,2026-02-06 13:16:16.376650
Ivanti,Ivanti EPM,True,True,13,1.0,33,59,57,{},CVE-2024-13160,9986,2026-02-06 13:16:16.323335
Elber,Elber (multiple products),True,True,13,1.0,44,37,44,{},CVE-2025-0674,2200,2026-02-06 13:16:16.352092
Gladinet,Gladinet CentreStack & Triofox,True,True,13,3.0,39,36,30,{},CVE-2025-12480,714,2026-02-06 13:16:16.274472
Paessler,PRTG Network Monitor,True,True,13,1.0,36,51,34,{},CVE-2018-19410,1132,2026-02-07 13:05:04.337462
strapi,strapi,True,True,13,1.0,30,65,43,{},CVE-2019-18818,34695,2026-02-07 13:05:04.286702
Citrix,Citrix SD-WAN and NetScaler SD-WAN,True,True,13,1.0,35,44,43,{},CVE-2019-12985,68889,2026-02-07 13:05:04.354187
n8n,n8n,True,True,13,5.0,14,19,19,{},CVE-2026-21858,31,2026-02-07 13:05:04.317922
Citrix,Citrix SD-WAN and NetScaler SD-WAN,True,True,13,1.0,37,65,42,{},CVE-2019-12989,2177,2026-02-07 13:05:04.180382
SibSoft,Xfilesharing,True,True,13,1.0,38,44,41,{},CVE-2019-18952,213,2026-02-07 13:05:04.371412
Arc53,DocsGPT,True,True,13,1.0,35,31,32,{},CVE-2025-0868,4377,2026-02-06 13:16:16.451320
D-Link,D-Link multiple routers,True,True,13,1.0,32,88,144,{},CVE-2018-6530,79800,2026-02-07 13:05:04.263287
Wordpress,Wordpress Visualizer plugin (by Themeisle),True,True,13,2.0,13,13,13,"{'26/10/2025': {'connections': 13, 'uniq_ips': 2}}",CVE-2019-16932,71,2025-10-26 12:48:32.001159
VMware,VMware NSX SD-WAN Edge,True,True,13,1.0,42,67,67,{},CVE-2018-6961,346,2026-02-07 13:05:04.287514
Tenda,Tenda AC18,True,True,12,1.0,12,12,12,"{'22/12/2025': {'connections': 12, 'uniq_ips': 1}}",CVE-2024-30891,12,2025-12-22 12:57:04.211320
ASUSTOR,ASUSTOR ADM,True,True,12,1.0,34,66,40,{},CVE-2018-11511,922,2026-02-07 13:05:04.222406
MobileIron,MobileIron Mobile Device Management (MDM),True,True,12,2.0,34,96,137,{},CVE-2020-15505,100214,2026-02-07 13:05:04.264892
Embedthis,GoAhead,True,True,12,1.0,12,12,12,"{'13/03/2025': {'connections': 12, 'uniq_ips': 1}}",CVE-2017-17562,12,2025-03-13 12:48:14.311821
Microsoft,Exchange,True,True,12,2.0,20,36,161,{},CVE-2021-34473,63508,2026-02-07 13:05:04.179325
mongo-express,mongo-express,True,True,12,1.0,28,41,38,{},CVE-2019-10758,34658,2026-02-07 13:05:04.330147
Wordpress,Wordpress BadgeOS plugin,True,True,12,3.0,24,39,31,{},CVE-2022-2958,14116,2026-02-07 13:05:04.342750
Wordpress,Wordpress The True Ranker plugin,True,True,12,1.0,20,14,17,{},CVE-2021-39312,3189,2026-01-27 13:06:27.988543
Changjetong,Changjetong T+,True,True,12,1.0,61,43,43,{},CVE-2023-7334,149,2026-02-07 13:05:04.217467
WAVLINK,WAVLINK WN535K2 and WN535K3,True,True,12,2.0,42,95,100,{},CVE-2022-2488,62337,2026-02-07 13:05:04.248120
Fortinet,FortiOS,True,True,12,2.0,2877,2981,3936,{},CVE-2018-13379,2245489,2026-02-06 13:16:16.393785
CyberPanel,CyberPanel,True,True,12,4.0,14,31,23,{},CVE-2024-32735,5444,2026-02-06 13:16:16.359599
Qingdao Easysoft,ZenTao,True,True,12,1.0,61,48,48,{},CVE-2022-4984,203,2026-02-07 13:05:04.298134
Zyxel,"USG FLEX 100, 100W, 200, 500, 700, USG20-VPN, USG20W-VPN, ATP 100, 200, 500, 700, 800",True,True,12,2.0,57,86,59,{},CVE-2022-30525,20184,2026-02-07 13:05:04.383660
Totolink,EX200,True,True,11,2.0,71,97,61,{},CVE-2021-43711,21459,2026-02-07 13:05:04.231648
Zoho,"ManageEngine Access Manager Plus, Password Manager Pro, PAM360",True,True,11,2.0,32,43,28,{},CVE-2022-29081,1441,2026-02-07 13:05:04.283294
D-Link,D-Link DCS-932L,True,True,11,1.0,132,149,149,{},CVE-2025-5571,263,2026-02-07 13:05:04.245408
Totolink,Totolink A3002R,True,True,11,1.0,139,185,185,{},CVE-2025-6485,536,2026-02-07 13:05:04.193002
Totolink,Totolink CA600-PoE,True,True,11,1.0,144,161,161,{},CVE-2025-44846,287,2026-02-07 13:05:04.248335
Crestron,Crestron HD-MD4X2-4K-E,True,True,11,4.0,13,32,20,{},CVE-2022-23178,9725,2026-02-06 13:16:16.425743
VoIPmonitor,VoIPmonitor,True,True,11,2.0,24,37,31,{},CVE-2022-24260,13786,2026-02-07 13:05:04.324725
PrestaShop,PrestaShop ApolloTheme AP PageBuilder module,True,True,11,2.0,49,99,84,{},CVE-2022-22897,130076,2026-02-07 13:05:04.314423
Hikvision,Hikvision DS series multiple products,True,True,11,2.0,37,19,22,{},CVE-2017-7921,3425,2026-02-07 13:05:04.199467
Linksys,"Linksys RE6250, RE6300, RE6350, RE6500, RE7000 and RE9000",True,True,11,1.0,136,169,169,{},CVE-2025-8829,511,2026-02-07 13:05:04.211654
Atlassian,Confluence,True,True,11,2.0,30,42,54,{},CVE-2022-26138,60706,2026-02-07 13:05:04.267038
Palo Alto Networks,Palo Alto Networks Expedition,True,True,11,2.0,44,71,71,{},CVE-2025-0107,591,2026-02-07 13:05:04.183380
Fortinet,FortiNAC,True,True,11,2.0,20,61,68,{},CVE-2022-39952,22410,2026-02-07 13:05:04.277549
Belkin,Belkin F9K1122,True,True,11,1.0,132,163,163,{},CVE-2025-7081,263,2026-02-07 13:05:04.308642
Wordpress,Wordpress Visual Form Builder plugin,True,True,10,1.0,4,4,4,{},CVE-2022-0142,34,2025-12-30 02:10:47.436799
Oracle,Oracle E-Business Suite (Oracle Web Applications Desktop Integrator),True,True,10,2.0,28,51,59,{},CVE-2022-21587,41183,2026-02-07 13:05:04.329262
Sonlogger,Sonlogger,True,True,10,1.0,39,78,75,{},CVE-2021-27964,32149,2026-02-07 13:05:04.189633
WAVLINK,WAVLINK WN535K2 and WN535K3,True,True,10,1.0,45,103,106,{},CVE-2022-2486,55487,2026-02-07 13:05:04.233771
Tenda,Tenda AC11,True,True,10,2.0,27,76,146,{},CVE-2021-31755,77661,2026-02-07 13:05:04.212283
anji-plus,AJ-Report,True,True,10,2.0,52,51,51,{},CVE-2024-7314,310,2026-02-07 13:05:04.248912
Wordpress,Wordpress ARPrice Lite plugin,True,True,10,2.0,17,37,31,{},CVE-2022-0867,14101,2026-02-07 13:05:04.187966
D-Link,DNS-320,True,True,10,1.0,29,74,141,{},CVE-2020-25506,101551,2026-02-07 13:05:04.251149
Wordpress,Wordpress KiviCare plugin,True,True,10,2.0,20,41,32,{},CVE-2022-0786,15409,2026-02-07 13:05:04.297940
Spring,Spring Cloud Function,True,True,10,1.0,10,10,317,{},CVE-2022-22963,1797,2026-02-06 13:16:16.286539
Node.js,Node.js (ejs),True,True,10,1.0,47,69,105,{},CVE-2022-29078,48268,2026-02-07 13:05:04.218362
Wordpress,Wordpress MapSVG plugin,True,True,10,2.0,23,46,32,{},CVE-2022-0592,4439,2026-02-07 13:05:04.227109
Wordpress,Wordpress Nirweb support plugin,True,True,10,2.0,22,41,32,{},CVE-2022-0781,14589,2026-02-07 13:05:04.306590
InfluxData,InfluxDB,True,True,10,3.0,14,29,24,{},CVE-2019-20933,11540,2026-02-06 13:16:16.426550
PyTorch,PyTorch TorchServe,True,True,10,1.0,17,89,57,{},CVE-2023-43654,1297,2026-02-07 13:05:04.297542
Wordpress,Wordpress WPCargo Track & Trace plugin,True,True,10,1.0,30,54,68,{},CVE-2021-25003,102063,2026-02-07 13:05:04.333142
frangoteam,FUXA,True,True,10,2.0,21,41,338,{},CVE-2023-33831,39144,2026-02-07 13:05:04.250748
Ivanti,Ivanti EPM,True,True,10,2.0,15,128,101,{},CVE-2024-29824,147269,2026-02-07 13:05:04.296541
NextGen Healthcare,Mirth Connect,True,True,10,2.0,19,684,1475,{},CVE-2023-37679,1342954,2026-02-07 13:05:04.194023
Wordpress,Wordpress Backup and Staging by WP Time Capsule plugin,True,True,10,2.0,22,37,61,{},CVE-2024-8856,7173,2026-02-07 13:05:04.376531
WSO2,WSO2 multiple products,True,True,10,2.0,23,37,43,{},CVE-2022-29464,18521,2026-02-07 13:05:04.344385
Atlassian,Confluence,True,True,10,2.0,24,66,127,{},CVE-2023-22518,73688,2026-02-07 13:05:04.335702
TP-Link,"TP-Link TL-WR840N v5, TL-WR841N v13",True,True,10,2.0,24,29,29,{},CVE-2018-11714,164,2026-02-07 13:05:04.313604
MiniIO,MiniIO Console,True,True,10,2.0,26,47,33,{},CVE-2021-41266,20195,2026-02-07 13:05:04.366984
Wordpress,Wordpress Keydatas plugin,True,True,10,2.0,28,31,31,{},CVE-2024-6220,252,2026-02-07 13:05:04.203614
MagnusSolution,magnusbilling,True,True,10,1.0,33,118,145,{},CVE-2023-30258,20760,2026-02-07 13:05:04.362903
NextChat (ChatGPT-Next-Web),NextChat (ChatGPT-Next-Web),True,True,10,1.0,45,132,98,{},CVE-2023-49785,48733,2026-02-07 13:05:04.316338
Gibbon,Gibbon,True,True,10,2.0,17,35,48,{},CVE-2023-45878,7513,2026-02-07 13:05:04.292424
NETGEAR,NETGEAR (multiple routers),True,True,10,4.0,6,43,25,{},CVE-2017-5521,3371,2026-02-06 13:16:16.327167
Zoho,ManageEngine ADAudit Plus,True,True,9,1.0,25,38,40,{},CVE-2022-28219,16798,2026-02-07 13:05:04.219968
NETGEAR,NETGEAR D6400,True,True,9,1.0,140,182,182,{},CVE-2025-7407,525,2026-02-07 13:05:04.234386
Adobe,ColdFusion,True,True,9,1.0,18,40,38,{},CVE-2023-29300,15329,2026-02-07 13:05:04.338276
SonicWall,SonicOS,True,True,9,1.0,14,75,203,{},CVE-2024-53704,70775,2026-02-07 13:05:04.195320
CONTEC,SolarView Compact ver.6.00,True,True,9,1.0,21,37,38,{},CVE-2022-29303,16171,2026-02-07 13:05:04.370387
Zyxel,Zyxel NAS326,True,True,9,1.0,13,37,56,{},CVE-2024-29973,17860,2026-02-07 13:05:04.259695
Progress,Telerik Report Server,True,True,9,1.0,23,37,48,{},CVE-2024-4358,14515,2026-02-07 13:05:04.191283
JetBrains,TeamCity,True,True,9,1.0,174,1444,4894,{},CVE-2023-42793,5285739,2026-02-07 13:05:04.365009
PuneethReddyHC,PuneethReddyHC,True,True,9,1.0,22,45,32,{},CVE-2021-41649,13323,2026-02-07 13:05:04.366080
Wordpress,Wordpress Automatic plugin,True,True,9,1.0,15,38,51,{},CVE-2024-27956,7711,2026-02-07 13:05:04.366625
Wordpress,Wordpress VR Calendar plugin,True,True,9,1.0,22,38,43,{},CVE-2022-2314,22324,2026-02-07 13:05:04.275538
Wordpress,Wordpress Product Table for WooCommerce (wooproducttable) plugin,True,True,9,1.0,18,40,33,{},CVE-2022-1020,12276,2026-02-07 13:05:04.208157
Atlassian,Confluence,True,True,9,1.0,45,363,407,{},CVE-2023-22515,1093664,2026-02-07 13:05:04.188595
Vanna,Vanna,True,True,9,1.0,13,33,50,{},CVE-2024-5827,13763,2026-02-07 13:05:04.277957
Penta Security,WAPPLES,True,True,9,1.0,15,38,34,{},CVE-2022-35413,19461,2026-02-07 13:05:04.206287
Wordpress,"Wordpress Free Booking Plugin for Hotels, Restaurant and Car Rental (eaSYNC)",True,True,9,1.0,16,36,37,{},CVE-2022-1952,16332,2026-02-07 13:05:04.279582
FOG Project,FOG,True,True,9,1.0,23,33,64,{},CVE-2024-39914,14062,2026-02-07 13:05:04.200481
Microchip Technology (Microsemi),SyncServer,True,True,9,1.0,15,36,41,{},CVE-2022-40022,14994,2026-02-07 13:05:04.358957
Microsoft,Open Management Infrastructure (OMI),True,True,9,1.0,22,37,37,{},CVE-2021-38647,20516,2026-02-07 13:05:04.206487
Atlassian,Confluence,True,True,9,1.0,9,9,9,{},CVE-2024-21683,890,2026-01-20 13:06:03.838511
Roxy-WI,Roxy-WI,True,True,9,1.0,22,38,40,{},CVE-2022-31161,3458,2026-02-07 13:05:04.263493
Geoserver,Geoserver (JAI-EXT),True,True,9,1.0,36,333,392,{},CVE-2022-24816,213262,2026-02-07 13:05:04.242890
Roxy-WI,Roxy-WI,True,True,9,1.0,25,41,39,{},CVE-2022-31126,15870,2026-02-07 13:05:04.183154
Adones Pitogo,angular-base64-upload,True,True,9,1.0,22,35,68,{},CVE-2024-42640,15125,2026-02-07 13:05:04.327430
dotCMS,dotCMS,True,True,9,1.0,24,39,44,{},CVE-2022-26352,18575,2026-02-07 13:05:04.363104
Wordpress,WordPress Fusion Builder plugin,True,True,9,1.0,17,41,33,{},CVE-2022-1386,14049,2026-02-07 13:05:04.291228
RaspAP,RaspAP,True,True,9,1.0,15,37,42,{},CVE-2022-39986,16424,2026-02-07 13:05:04.303256
The Digital Craft,AtomCMS,True,True,9,1.0,23,40,43,{},CVE-2022-25487,19604,2026-02-07 13:05:04.299822
Wordpress,Wordpress Steveas WP Live Chat Shoutbox plugin,True,True,9,1.0,24,40,38,{},CVE-2023-1020,12853,2026-02-07 13:05:04.182944
Wordpress,Wordpress WooCommerce Dropshipping plugin,True,True,9,1.0,20,34,31,{},CVE-2022-3481,2181,2026-02-07 13:05:04.320466
Progress,WhatsUp Gold,True,True,9,1.0,27,39,54,{},CVE-2024-6670,4902,2026-02-07 13:05:04.210659
F5,BIG-IP,True,True,9,1.0,34,51,71,{},CVE-2022-1388,74058,2026-02-07 13:05:04.188393
Wordpress,Wordpress Simple Link Directory plugin,True,True,9,1.0,26,38,30,{},CVE-2022-0760,15387,2026-02-07 13:05:04.231062
Home Assistant,Home Assistance (Supervisor),True,True,9,1.0,28,122,97,{},CVE-2023-27482,112303,2026-02-07 13:05:04.323965
Wordpress,Wordpress Bestbooks plugin,True,True,9,1.0,21,41,32,{},CVE-2022-0827,13898,2026-02-07 13:05:04.285289
Keysight Technologies,Sensor Management Server,True,True,9,1.0,25,42,29,{},CVE-2022-38130,1189,2026-02-07 13:05:04.301839
Wordpress,Wordpress WooCommerce Ultimate Gift Card plugin,True,True,9,1.0,31,40,37,{},CVE-2024-8425,993,2026-02-07 13:05:04.381232
Progress,WhatsUp Gold,True,True,9,1.0,20,35,51,{},CVE-2024-4885,8439,2026-02-07 13:05:04.197636
SecurEnvoy,SecurEnvoy MFA,True,True,9,1.0,25,42,40,{},CVE-2024-37393,1013,2026-02-07 13:05:04.347038
Wordpress,Wordpress WHMpress - WHMCS WordPress Integration Plugin plugin,True,True,9,1.0,22,34,50,{},CVE-2024-9193,2184,2026-02-07 13:05:04.192808
Wordpress,Wordpress SpeakOut! Email Petitions plugin,True,True,9,1.0,22,41,32,{},CVE-2022-0846,14548,2026-02-07 13:05:04.226722
Qualitor,Qualitor ITSM,True,True,9,1.0,25,38,77,{},CVE-2024-44849,14184,2026-02-07 13:05:04.346834
Wordpress,Wordpress Business Directory Plugin,True,True,9,1.0,22,26,26,{},CVE-2024-4443,163,2026-02-07 13:05:04.355546
Ivanti,Ivanti Virtual Traffic Manager (vTM),True,True,9,1.0,22,44,49,{},CVE-2024-7593,19937,2026-02-07 13:05:04.216852
WAVLINK,WAVLINK WN535K2 and WN535K3,True,True,9,2.0,23,36,34,{},CVE-2022-2487,17260,2026-02-07 13:05:04.260181
pfSense,pfSense pfBlockerNG,True,True,9,2.0,16,24,21,{},CVE-2022-31814,653,2026-02-07 13:05:04.217250
Open Automation Software,OAS Platform,True,True,9,1.0,25,40,32,{},CVE-2022-26833,19628,2026-02-07 13:05:04.311367
Wordpress,Wordpress WP Video Gallery plugin,True,True,9,1.0,24,37,31,{},CVE-2022-0826,14857,2026-02-07 13:05:04.320858
Roxy-WI,Roxy-WI,True,True,9,1.0,22,38,39,{},CVE-2022-31137,3666,2026-02-07 13:05:04.230866
Wordpress,Wordpress Elfinder plugin,True,True,9,1.0,25,35,31,{},CVE-2020-35235,13502,2026-02-07 13:05:04.284347
Zoho,ManageEngine Desktop Central (now Engine Central),True,True,9,1.0,28,40,35,{},CVE-2020-10189,33063,2026-02-07 13:05:04.194885
TP-Link,TP-Link TL-WR840N EU v5,True,True,9,1.0,23,44,41,{},CVE-2021-41653,20645,2026-02-07 13:05:04.204420
Dairy Farm Shop Management System,Dairy Farm Shop Management System v1.0,True,True,9,1.0,24,39,34,{},CVE-2022-29007,14880,2026-02-07 13:05:04.246218
Kramer,VIAware,True,True,9,1.0,31,52,51,{},CVE-2021-36356,25264,2026-02-07 13:05:04.303648
F5,F5 Big-IP,True,True,9,1.0,36,106,151,{},CVE-2020-5902,285555,2026-02-07 13:05:04.243339
Wordpress,Wordpress ProfilePress plugin,True,True,9,1.0,23,45,43,{},CVE-2021-34624,18206,2026-02-07 13:05:04.212684
Wordpress,Wordpress POST SMTP Mailer plugin,True,True,9,1.0,16,24,24,{},CVE-2023-6875,120,2026-02-07 13:05:04.369029
Emerson Dixell,XWEB-500,True,True,9,1.0,28,45,42,{},CVE-2021-45420,13261,2026-02-07 13:05:04.331532
Wordpress,Wordpress Perfect Survey plugin,True,True,9,2.0,25,37,32,{},CVE-2021-24762,24608,2026-02-07 13:05:04.262057
Wordpress,Wordpress HTML2WP plugin,True,True,9,1.0,16,40,31,{},CVE-2022-1574,1076,2026-02-07 13:05:04.182746
RosarioSIS,RosarioSIS,True,True,9,1.0,23,44,32,{},CVE-2021-44427,11252,2026-02-07 13:05:04.205870
SAP,NetWeaver Development Infrastructure,True,True,9,1.0,24,38,32,{},CVE-2021-33690,16023,2026-02-07 13:05:04.328239
Aviatrix,Aviatrix Controller,True,True,9,1.0,24,43,40,{},CVE-2021-40870,22820,2026-02-07 13:05:04.319132
Sitecore,Sitecore XP,True,True,9,1.0,27,49,39,{},CVE-2021-42237,18305,2026-02-07 13:05:04.221994
NETGEAR,NETGEAR ProSafe FVS336Gv2/FVS336Gv3,True,True,9,1.0,25,44,36,{},CVE-2022-29383,21060,2026-02-07 13:05:04.218962
Zoho,ManageEngine ADSelfService Plus,True,True,9,1.0,33,52,78,{},CVE-2021-40539,77654,2026-02-07 13:05:04.305158
SonarQube,SonarQube,True,True,9,5.0,6,20,11,{},CVE-2020-27986,12278,2026-02-06 13:16:16.251911
Dahua,Dahua (multiple products),True,True,9,1.0,25,37,32,{},CVE-2021-33044,16527,2026-02-07 13:05:04.233381
D-Link,"DIR-810L, DIR-820L/LW, DIR-826L, DIR-830L, DIR-836L",True,True,9,1.0,24,75,144,{},CVE-2021-45382,70105,2026-02-07 13:05:04.266469
Sunhillo,Sureline,True,True,9,1.0,23,72,143,{},CVE-2021-36380,71207,2026-02-07 13:05:04.251783
PHPGurukul,Hospital Management System,True,True,9,1.0,15,31,32,{},CVE-2020-22165,12788,2026-02-07 13:05:04.287104
Wordpress,Wordpress Title Experiments Free plugin,True,True,8,1.0,17,36,30,{},CVE-2022-0784,13918,2026-02-07 13:05:04.195704
Wordpress,Wordpress Infographic Maker plugin,True,True,8,1.0,21,42,33,{},CVE-2022-0747,15139,2026-02-07 13:05:04.321510
Wordpress,Wordpress Users Ultra plugin,True,True,8,1.0,27,42,31,{},CVE-2022-0769,14568,2026-02-07 13:05:04.236781
HPE,HPE Edgeline Infrastructure Manager,True,True,8,1.0,23,45,39,{},CVE-2021-29203,23786,2026-02-07 13:05:04.181619
Wordpress,Wordpress Car Seller - Auto Classifieds Script plugin,True,True,8,1.0,25,43,34,{},CVE-2021-24285,24349,2026-02-07 13:05:04.365562
Lumis,LumisXP,True,True,8,1.0,23,42,34,{},CVE-2021-27931,26496,2026-02-07 13:05:04.298550
FatPipe,FatPipe WARP/IPVPN/MPVPN,True,True,8,1.0,27,45,34,{},CVE-2021-27855,9499,2026-02-07 13:05:04.299133
Wordpress,Wordpress Narnoo Distributor plugin,True,True,8,1.0,21,42,38,{},CVE-2022-0679,19169,2026-02-07 13:05:04.222891
Wordpress,Wordpress Hunk Companion plugin,True,True,8,1.0,22,43,43,{},CVE-2024-9707,933,2026-02-07 13:05:04.340729
Microsoft,.NET Framework,True,True,8,7.0,7,14,17,{},CVE-2024-29059,8421,2026-02-06 13:16:16.287976
Wordpress,Wordpress Block and Stop Bad Bots plugin,True,True,8,1.0,22,40,41,{},CVE-2021-24499,34426,2026-02-07 13:05:04.354428
NextGen Healthcare,Mirth Connect,True,True,8,1.0,69,89,80,{},CVE-2023-43208,87360,2026-02-07 13:05:04.279782
HooToo,HooToo TripMate Titan HT-TM05 and HT-05 routers,True,True,8,1.0,8,8,8,"{'05/08/2024': {'connections': 8, 'uniq_ips': 1}, '06/08/2024': {'connections': 8, 'uniq_ips': 1}}",CVE-2018-20841,8,2024-08-06 06:01:20.183289
FiberHome,FiberHome ONU GPON AN550,True,True,8,1.0,8,8,8,"{'21/12/2024': {'connections': 8, 'uniq_ips': 1}}",CVE-2021-42912,8,2024-12-21 12:39:56.527574
Cisco,Cisco RV132W/RV134W,True,True,8,2.0,13,27,18,{},CVE-2018-0127,12552,2026-02-06 13:16:16.270142
Wordpress,Wordpress Kaswara Modern VC Addons plugin,True,True,8,1.0,24,47,47,{},CVE-2021-24284,37738,2026-02-07 13:05:04.217671
Micro Focus,Operations Bridge Reporter (OBR),True,True,7,1.0,27,76,161,{},CVE-2021-22502,87664,2026-02-07 13:05:04.225520
IBM,IBM Operational Decision Manager,True,True,7,1.0,12,44,88,{},CVE-2024-22319,19105,2026-02-06 13:16:16.252839
Gurock (Sembi),TestRail,True,True,7,4.0,6,22,17,{},CVE-2021-40875,962,2026-02-07 13:05:04.269699
Wordpress,Wordpress Secure Copy Content Protection and Content Locking plugin,True,True,7,1.0,53,78,81,{},CVE-2021-24931,83982,2026-02-07 13:05:04.320067
Lucee,Lucee Server,True,True,7,1.0,27,41,50,{},CVE-2021-21307,54841,2026-02-07 13:05:04.257867
Telos Alliance,Omnia MPX Node,True,True,7,1.0,13,25,21,{},CVE-2022-36642,10950,2026-02-06 13:16:16.328838
OpenTSDB,OpenTSDB,True,True,7,1.0,13,42,94,{},CVE-2020-35476,27034,2026-02-06 13:16:16.387573
Rejetto,Rejetto HTTP File Server,True,True,7,1.0,12,48,99,{},CVE-2024-23692,24809,2026-02-06 13:16:16.300802
Wordpress,"Wordpress Poll, Survey, Questionnaire and Voting system plugin",True,True,7,1.0,26,42,36,{},CVE-2021-24442,4798,2026-02-07 13:05:04.304058
QNAP,QNAP NAS running HBS 3,True,True,7,1.0,30,47,47,{},CVE-2021-28799,214,2026-02-07 13:05:04.284788
acmailer,acmailer,True,True,7,1.0,30,44,35,{},CVE-2021-20617,956,2026-02-07 13:05:04.253997
"Open Source Matters, Inc/Joomla community",Joomla,True,True,7,7.0,4,37,38,{},CVE-2023-23752,142298,2026-02-06 13:16:16.396836
VMware,vCenter,True,True,7,1.0,26,45,35,{},CVE-2021-22005,42307,2026-02-07 13:05:04.360090
Pulse Secure,Pulse Secure VPN,True,True,7,3.0,277,329,370,{},CVE-2019-11510,270884,2026-02-07 13:05:04.216259
PHPJabbers,PHPJabbers Food Delivery Script,True,True,7,1.0,15,21,21,{},CVE-2023-40748,137,2026-02-07 13:05:04.185018
Progress,Flowmon,True,True,7,1.0,13,38,366,{},CVE-2024-2389,35372,2026-02-06 13:16:16.439751
Kaseya,VSA,True,True,7,1.0,30,51,50,{},CVE-2021-30118,2863,2026-02-07 13:05:04.318549
Dahua,Dahua EIMS,True,True,7,1.0,13,44,101,{},CVE-2024-13985,3305,2026-02-06 13:16:16.351688
Dynamicweb Software,Dynamicweb,True,True,7,1.0,13,39,81,{},CVE-2022-25369,18347,2026-02-06 13:16:16.275693
Rocket.Chat,Rocket.Chat,True,True,7,1.0,27,42,36,{},CVE-2021-22911,28186,2026-02-07 13:05:04.288531
Schneider Electric,"EVlink City, Parking and Smart Wallbox",True,True,7,1.0,30,54,37,{},CVE-2021-22707,40499,2026-02-07 13:05:04.228632
Cacti,Cacti,True,True,7,1.0,12,43,92,{},CVE-2024-29895,14354,2026-02-06 13:16:16.325755
RaspAP,RaspAP,True,True,7,1.0,13,46,98,{},CVE-2021-33357,19294,2026-02-06 13:16:16.340552
SAP,SCIMono,True,True,6,1.0,12,24,30,{},CVE-2021-21479,6774,2026-02-06 13:16:16.281580
Alibaba,Nacos,True,True,6,1.0,17,50,34,{},CVE-2021-29441,38939,2026-02-07 13:05:04.335924
Wordpress,Wordpress Paid Memberships Pro plugin,True,True,6,1.0,21,36,32,{},CVE-2021-25114,35850,2026-02-07 13:05:04.323364
XWiki,XWiki Platform,True,True,6,1.0,12,54,193,{},CVE-2025-24893,17909,2026-02-06 13:16:16.348737
Grafana,Grafana,True,True,6,3.0,5,23,18,{},CVE-2021-39226,11204,2026-02-06 13:16:16.420167
Fortinet,FortiWLM,True,True,6,1.0,18,151,263,{},CVE-2023-34993,35867,2026-02-06 13:16:16.329061
skittles,Simple Employee Records System 1.0,True,True,6,1.0,30,47,47,{},CVE-2021-4462,182,2026-02-07 13:05:04.295121
Oracle,Oracle Access Manager (Oracle Fusion Middleware),True,True,6,2.0,12,61,94,{},CVE-2021-35587,37410,2026-02-07 13:05:04.352821
WAVLINK,WAVLINK WL-WN533A8,True,True,6,2.0,9,31,32,{},CVE-2022-48164,6969,2026-02-06 13:16:16.264344
Ignite Realtime,Openfire,True,True,6,1.0,11,22,18,"{'06/02/2026': {'connections': 6, 'uniq_ips': 2}}",CVE-2019-18394,8922,2026-02-06 13:16:16.290128
Yachtcontrol,Yachtcontrol,True,True,6,1.0,11,22,25,{},CVE-2019-17270,8796,2026-02-06 13:16:16.390778
TamronOS,TamronOS IPTV/VOD,True,True,6,1.0,11,15,15,"{'06/02/2026': {'connections': 6, 'uniq_ips': 2}}",CVE-2023-3606,64,2026-02-06 13:16:16.301817
Linear,eMerge E3-series,True,True,6,1.0,12,25,19,{},CVE-2022-38627,898,2026-02-06 13:16:16.424111
Realtek,Realtek SDK,True,True,6,1.0,60,123,159,{},CVE-2021-35395,70086,2026-02-07 13:05:04.178697
Advantech,R-SeeNet,True,True,6,1.0,11,23,29,{},CVE-2021-21805,5684,2026-02-06 13:16:16.421400
Appspace,Appspace,True,True,6,1.0,12,15,15,{},CVE-2021-27670,63,2026-02-06 13:16:16.398206
Lansweeper,Lansweeper,True,True,6,1.0,11,23,18,{},CVE-2019-13462,2873,2026-02-06 13:16:16.366999
Progress,Kemp LoadMaster,True,True,6,1.0,11,25,46,{},CVE-2024-1212,17310,2026-02-06 13:16:16.355600
LimeSurvey,LimeSurvey,True,True,6,1.0,13,24,21,{},CVE-2020-11455,5540,2026-02-06 13:16:16.249423
WAVLINK,WAVLINK WN579X3,True,True,6,3.0,5,24,13,{},CVE-2022-31847,11828,2026-02-06 13:16:16.405415
LOYTEC,LOYTEC LGATE-902,True,True,6,1.0,11,27,20,{},CVE-2018-14918,7670,2026-02-06 13:16:16.271524
becon,DATAGERRY,True,True,6,3.0,6,30,15,{},CVE-2024-50967,1150,2026-02-06 13:16:16.363085
SolarWinds,SolarWinds Orion,True,True,6,1.0,12,23,28,{},CVE-2020-10148,15600,2026-02-06 13:16:16.298241
Artica,Artica Web Proxy,True,True,6,1.0,12,48,34,"{'06/02/2026': {'connections': 6, 'uniq_ips': 2}}",CVE-2020-17506,54904,2026-02-06 13:16:16.438963
Apache,Apache HTTP Server,True,True,6,1.0,27,30,28,{},CVE-2024-38475,3385,2026-02-06 13:16:16.290747
oria,gridx,True,True,6,1.0,11,25,33,{},CVE-2020-19625,7370,2026-02-06 13:16:16.395366
rConfig,rConfig,True,True,6,1.0,12,22,17,{},CVE-2020-10548,6142,2026-02-06 13:16:16.397382
Wordpress,Wordpress Welcart eCommerce plugin,True,True,6,1.0,12,22,16,{},CVE-2022-41840,4741,2026-02-06 13:16:16.254842
Wordpress,Wordpress Admin Word Count Column plugin,True,True,6,1.0,12,23,17,{},CVE-2022-1390,4738,2026-02-06 13:16:16.428658
NETGEAR,NETGEAR ReadyNAS Surveillance,True,True,6,1.0,11,22,30,"{'06/02/2026': {'connections': 6, 'uniq_ips': 2}}",CVE-2017-18378,7923,2026-02-06 13:16:16.366528
Riello UPS,Netman 2024,True,True,6,1.0,12,24,21,{},CVE-2024-8877,3084,2026-02-06 13:16:16.423710
WAVLINK,WAVLINK WN530H4,True,True,6,1.0,11,23,29,{},CVE-2020-12124,8530,2026-02-06 13:16:16.267903
Atlassian,JIRA Seraph,True,True,6,1.0,11,20,17,"{'06/02/2026': {'connections': 6, 'uniq_ips': 2}}",CVE-2022-0540,21329,2026-02-06 13:16:16.332539
Mida Solutions,Mida eFramework,True,True,6,1.0,12,23,30,"{'06/02/2026': {'connections': 6, 'uniq_ips': 2}}",CVE-2020-15920,7112,2026-02-06 13:16:16.379334
benc-uk,KubeView,True,True,6,1.0,11,22,18,{},CVE-2022-45933,9753,2026-02-06 13:16:16.340950
QNAP,QNAP NAS devices running Photo Station,True,True,6,1.0,11,24,24,{},CVE-2022-27593,7270,2026-02-06 13:16:16.299787
Wordpress,Wordpress InPost Gallery plugin,True,True,6,1.0,12,24,19,{},CVE-2022-4063,4206,2026-02-06 13:16:16.270713
rConfig,rConfig,True,True,6,1.0,12,21,16,"{'06/02/2026': {'connections': 6, 'uniq_ips': 2}}",CVE-2020-10546,5732,2026-02-06 13:16:16.369657
WyreStorm,WyreStorm Apollo VX20,True,True,6,3.0,6,30,13,{},CVE-2024-25735,17364,2026-02-06 13:16:16.417856
TopThink,ThinkPHP,True,True,6,1.0,11,23,20,{},CVE-2022-47945,5951,2026-02-06 13:16:16.450887
SolarWinds,SolarWinds Serv-U,True,True,6,6.0,12,24,85,{},CVE-2024-28995,253618,2026-02-06 13:16:16.378528
Ruby Dragonfly,Ruby Dragonfly,True,True,5,1.0,11,23,42,"{'06/02/2026': {'connections': 5, 'uniq_ips': 1}}",CVE-2021-33564,8748,2026-02-06 13:16:16.269553
Lime Technology,Unraid,True,True,5,1.0,9,55,155,{},CVE-2020-5847,55310,2026-02-07 13:05:04.335135
Emby,Emby Server,True,True,5,1.0,11,22,21,{},CVE-2020-26948,509,2026-02-06 13:16:16.442110
Cybele Software,Thinfinity VirtualUI,True,True,5,1.0,11,25,22,"{'06/02/2026': {'connections': 5, 'uniq_ips': 1}}",CVE-2021-45092,5087,2026-02-06 13:16:16.371234
QNAP,QNAP QTS,True,True,5,3.0,3,6,5,{},CVE-2020-2507,1877,2026-01-24 02:10:29.388857
Pascom,Pascom Cloud Phone System,True,True,5,1.0,9,41,28,{},CVE-2021-45967,15206,2026-02-07 13:05:04.328447
HPE,LinuxKI,True,True,5,1.0,87,91,97,{},CVE-2020-7209,12651,2026-02-07 13:05:04.213392
Wordpress,Wordpress Automatic plugin,True,True,5,1.0,12,24,19,{},CVE-2024-27954,14161,2026-02-06 13:16:16.394750
Cisco,"Cisco RV340, RV340W, RV345, and RV345P Dual WAN Gigabit VPN Routers",True,True,5,1.0,25,24,21,{},CVE-2023-20073,18048,2026-02-06 13:16:16.341522
ZyXEL,ZyXEL NAS,True,True,5,1.0,9,57,132,{},CVE-2020-9054,49567,2026-02-07 13:05:04.215234
Yealink,Yealink Device Management (DM),True,True,5,1.0,11,24,28,{},CVE-2021-27561,5715,2026-02-06 13:16:16.400582
rConfig,rConfig,True,True,5,1.0,12,19,24,{},CVE-2019-16662,16898,2026-02-06 13:16:16.356607
Dassualt Systems,DELMIA Apriso,True,True,5,1.0,35,29,34,{},CVE-2025-6205,850,2026-02-07 13:05:04.307616
Zeroshell,Zeroshell Linux Router,True,True,5,1.0,11,24,33,{},CVE-2009-0545,11043,2026-02-06 13:16:16.294444
Eaton,Intelligent Power Manager,True,True,5,1.0,10,26,60,{},CVE-2018-12031,16126,2026-02-07 13:05:04.182336
Elastic,Kibana,True,True,5,2.0,10,21,15,{},CVE-2018-17246,7347,2026-02-07 13:05:04.217055
Citrix,Application Delivery Controller,True,True,5,2.0,1774,1746,2678,{},CVE-2019-19781,980056,2026-02-07 13:05:04.319652
Cisco,Cisco IOS,True,True,5,1.0,21,58,94,{},CVE-2001-0537,69706,2026-02-07 13:05:04.235614
Wowza Media Systems,Wowza Streaming Engine,True,True,5,1.0,12,25,19,{},CVE-2018-19365,5471,2026-02-06 13:16:16.389839
SpectoLabs,HoverFly,True,True,5,2.0,30,17,33,{},CVE-2025-54123,873,2026-02-07 13:05:04.239531
Kentico,Kentico,True,True,4,1.0,9,13,18,{},CVE-2019-10068,1314,2026-01-27 13:06:28.012628
GeoVision,GeoVision GeoWebServer,True,True,4,2.0,7,31,31,{},CVE-2021-47795,67,2026-02-06 13:16:16.374583
FlowiseAI,Flowise,True,True,4,1.0,35,26,23,{},CVE-2025-55346,414,2026-02-07 13:05:04.312614
Fortinet,Fortinet FortiWeb,True,True,4,1.0,26,38,61,{},CVE-2025-25257,9280,2026-02-06 13:16:16.440100
MinIO,MinIO,True,True,4,2.0,5,14,16,{},CVE-2023-28432,19166,2026-02-06 13:16:16.426755
Apache,Apache HTTP Server,True,True,4,1.0,15,50,142,{},CVE-2021-40438,47661,2026-02-07 13:05:04.355749
LG,LG AC Smart II,True,True,4,2.0,27,37,30,{},CVE-2025-10204,138,2026-02-06 13:16:16.344005
Versa,Versa Concerto,True,True,4,2.0,21,19,44,{},CVE-2025-34026,1857,2026-02-06 13:16:16.431272
Microsoft,Windows Server Update Service,True,True,4,1.0,60,41,74,{},CVE-2025-59287,4508,2026-02-07 13:05:04.237414
Adobe,Adobe Commerce (Magento),True,True,4,1.0,31,24,44,{},CVE-2025-54236,1091,2026-02-07 13:05:04.347665
Fortinet,"FortiOS, FortiProxy, and FortiSwitchManager",True,True,4,2.0,3241,3843,4281,{},CVE-2022-40684,1657269,2026-02-06 13:16:16.278651
Securden,Securden Unified PAM,True,True,4,1.0,30,29,49,{},CVE-2025-53118,1536,2026-02-07 13:05:04.339300
Evertz,Evertz SDVN 3080ipx-10G and others,True,True,4,1.0,30,16,53,{},CVE-2025-4009,7290,2026-02-07 13:05:04.374245
Dahua,Dahua DVR/NVR/IPC,True,True,4,1.0,10,61,73,{},CVE-2017-7927,31345,2026-02-07 13:05:04.214420
CrushFTP,CrushFTP,True,True,4,1.0,3,57,268,{},CVE-2025-54309,10453,2026-02-07 13:05:04.344572
phpMyFAQ,phpMyFAQ,True,True,4,2.0,31,40,40,{},CVE-2025-69200,118,2026-02-06 13:16:16.419762
Aquatronica,Aquatronica Control System,True,True,4,2.0,30,31,31,{},CVE-2025-25037,110,2026-02-06 13:16:16.265041
Revolution PI,Revolution PI webstatus and others,True,True,4,2.0,26,23,45,"{'06/02/2026': {'connections': 4, 'uniq_ips': 1}}",CVE-2025-41646,2570,2026-02-06 13:16:16.309292
SolarWinds,Serv-U,True,True,4,1.0,11,16,18,{},CVE-2021-35250,13983,2026-01-27 13:06:28.040238
Mitel,"Mitel 6800 Series, 6900 Series, and 6900w Series SIP Phones, 6970 Conference Unit",True,True,4,2.0,17,13,13,{},CVE-2025-47188,18,2026-02-07 13:05:04.285702
FreePBX,FreePBX,True,True,4,1.0,26,21,65,{},CVE-2025-57819,2802,2026-02-07 13:05:04.244379
Totolink,Totolink A720R,True,True,4,2.0,6,28,28,{},CVE-2025-4270,531,2026-02-06 13:16:16.420582
Progress,Chef Automate,True,True,4,1.0,34,25,22,{},CVE-2025-8868,469,2026-02-07 13:05:04.195885
Fortinet,Fortinet FortiWeb,True,True,4,1.0,29,52,152,{},CVE-2025-64446,7957,2026-02-07 13:05:04.305786
Cisco,Cisco Smart Licensing Utility,True,True,4,2.0,6,25,20,{},CVE-2024-20440,329,2026-02-06 13:16:16.348531
Smart Office Payroll,Smart Office Web,True,True,4,2.0,6,32,18,{},CVE-2022-47075,1387,2026-02-06 13:16:16.432863
Versa,Versa Concerto,True,True,4,2.0,26,21,45,{},CVE-2025-34027,2003,2026-02-06 13:16:16.284161
Bonitasoft,Bonitasoft,True,True,4,1.0,8,13,18,{},CVE-2022-25237,1273,2026-01-27 13:06:28.001853
Thruk,Thruk,True,True,4,2.0,7,27,21,{},CVE-2022-23961,15558,2026-02-06 13:16:16.345946
SonicWall,SonicOS,True,True,4,4.0,29,1355,1322,{},CVE-2023-0656,457332,2026-02-07 13:05:04.232972
Zoho,"ManageEngine OpManager OpManager Plus, OpManager MSP, Network Configuration Manager, NetFlow Analyzer, Firewall Analyzer, and OpUtils",True,True,4,2.0,15,26,19,{},CVE-2022-36923,955,2026-02-06 13:16:16.259100
CrushFTP,CrushFTP,True,True,3,1.0,49,52,157,{},CVE-2025-2825,247506,2026-02-07 13:05:04.275742
Wordpress,Wordpress,True,True,3,1.0,3,2,4,{},CVE-2020-25213,1082,2026-02-07 13:05:04.316140
SonicWall,SonicOS,True,True,3,3.0,38,1484,1418,{},CVE-2022-22274,905631,2026-02-07 13:05:04.224525
Wordpress,Wordpress Social Warfare plugin,True,True,3,2.0,10,53,150,{},CVE-2019-9978,31847,2026-02-07 13:05:04.185852
GitLab,GitLab CE/EE,True,True,3,1.0,2,3,17,{},CVE-2021-4191,34056,2026-02-07 13:05:04.196522
TBK,DVR4104/DVR4216 and multiple re-branded versions,True,True,3,2.0,26,30,17,{},CVE-2018-9995,92132,2026-02-02 13:16:42.920047
Adobe,ColdFusion,True,True,3,1.0,3,3,10,{},CVE-2021-21087,66444,2026-02-07 13:05:04.244164
Totolink,Totolink T10,True,True,3,1.0,3,3,3,"{'16/12/2025': {'connections': 3, 'uniq_ips': 1}}",CVE-2024-9001,300,2025-12-16 13:00:01.439863
Jellyfin,Jellyfin,True,True,3,1.0,3,3,7,{},CVE-2021-21402,5953,2026-02-07 13:05:04.285902
ThoughtWorks,GoCD,True,True,3,1.0,4,3,4,{},CVE-2021-43287,4593,2026-02-07 13:05:04.205053
Cisco,Cisco Unified IP Conference Station 7937G,True,True,3,2.0,5,11,4,{},CVE-2020-16139,574,2026-02-06 13:16:16.286951
Samsung,WLAN AP WEA453e,True,True,3,2.0,13,14,14,{},CVE-2025-34068,43,2026-02-07 13:05:04.383483
C-DATA,C-DATA Web Management System,True,True,3,2.0,3,6,12,{},CVE-2022-4257,1686,2026-02-07 13:05:04.283518
JSONPath-Plus,JSONPath-plus,True,True,3,1.0,52,30,25,"{'06/02/2026': {'connections': 3, 'uniq_ips': 1}}",CVE-2025-1302,400,2026-02-06 13:16:16.251379
Apache,nan,True,True,3,1.0,9,16,24,{},CVE-2023-33246,5244,2026-02-06 13:16:16.402640
Wordpress,Wordpress LearnPress plugin,True,True,3,1.0,3,3,3,"{'09/11/2025': {'connections': 3, 'uniq_ips': 1}, '17/11/2025': {'connections': 3, 'uniq_ips': 1}}",CVE-2023-6634,7779,2025-11-09 12:48:24.429293
Terramaster,TOS,True,True,3,1.0,6,65,87,{},CVE-2022-24990,20443,2026-02-07 13:05:04.186671
Tenda,Tenda AC1206,True,True,3,1.0,7,7,7,{},CVE-2025-7544,13,2026-01-27 13:06:27.923947
CWP,CWP (Control Web Panel),True,True,2,1.0,2,2,2,{},CVE-2025-48703,2,2025-08-16 12:50:50.372442
Adobe,ColdFusion,True,True,2,1.0,2,2,2,"{'31/12/2024': {'connections': 2, 'uniq_ips': 1}}",CVE-2023-26360,2,2024-12-31 12:42:05.570163
Wordpress,Wordpress Duplicator plugin,True,True,2,1.0,2,31,68,{},CVE-2020-11738,19838,2026-02-07 13:05:04.200707
Landray,Landray EIS,True,True,2,1.0,2,2,2,"{'29/11/2025': {'connections': 2, 'uniq_ips': 1}}",CVE-2025-22214,2,2025-11-29 12:51:06.030802
Airspan,Airspot 5410,True,True,2,1.0,2,2,2,"{'15/09/2024': {'connections': 2, 'uniq_ips': 1}}",CVE-2022-36267,3,2024-09-15 12:39:34.721172
Palo Alto Networks,PAN-OS,True,True,2,1.0,34,99,121,{},CVE-2024-9474,105629,2026-02-07 13:05:04.358784
DedeCMS,DedeCMS,True,True,2,1.0,2,2,4,{},CVE-2018-7700,7106,2026-02-07 13:05:04.226337
KevinLAB,Building Energy Management System,True,True,2,1.0,13,16,17,{},CVE-2021-37291,9615,2026-02-07 13:05:04.285075
Wordpress,Wordpress Advanced Booking Calendar plugin,True,True,2,1.0,14,21,31,"{'06/02/2026': {'connections': 2, 'uniq_ips': 1}}",CVE-2022-1006,1224,2026-02-06 13:16:16.310071
Totolink,A3002RU,True,True,2,1.0,2,2,2,"{'06/12/2025': {'connections': 2, 'uniq_ips': 1}}",CVE-2018-13307,264,2025-12-06 12:51:22.434935
Zoho,ManageEngine OpManager,True,True,2,1.0,2,2,4,"{'08/01/2026': {'connections': 2, 'uniq_ips': 1}, '09/01/2026': {'connections': 2, 'uniq_ips': 1}, '06/02/2026': {'connections': 2, 'uniq_ips': 1}}",CVE-2018-17283,781,2026-01-08 13:01:16.047065
Wordpress,Wordpress News & Blog Designer Pack plugin,True,True,2,1.0,17,23,48,"{'06/02/2026': {'connections': 2, 'uniq_ips': 1}}",CVE-2023-5815,1824,2026-02-06 13:16:16.299615
Wordpress,Wordpress Youzify plugin,True,True,2,1.0,2,2,2,{},CVE-2022-1950,1019,2026-01-10 02:09:33.580047
Myucms,Myucms,True,True,2,2.0,31,23,28,{},CVE-2020-21650,15563,2026-02-07 13:05:04.321714
Oracle,Oracle Business Intelligence (Oracle Fusion Middleware,True,True,2,1.0,2,18,9,{},CVE-2020-14864,6930,2026-02-07 13:05:04.211876
Apache,libapache-mod-jk,True,True,2,2.0,4,12,84,{},CVE-2018-11759,48013,2026-02-07 13:05:04.355942
SAP,BusinessObjects Business Intelligence Platform (Web Services),True,True,2,1.0,2,2,2,"{'15/09/2024': {'connections': 2, 'uniq_ips': 1}}",CVE-2020-6308,2,2024-09-15 12:39:34.689437
D-Link,D-Link DIR-859,True,True,2,1.0,184,184,366,{},CVE-2019-17621,16484,2026-02-07 13:05:04.373240
Totolink,TOTOLINK Realtek SDK based routers,True,True,2,1.0,174,83,113,{},CVE-2019-19824,64741,2026-02-07 13:05:04.199684
SearchBlox,SearchBlox,True,True,2,1.0,2,19,12,{},CVE-2020-35580,5155,2026-02-07 13:05:04.229038
Quest,Quest KACE K1000 Systems Management Appliance,True,True,2,1.0,2,2,2,"{'29/06/2024': {'connections': 2, 'uniq_ips': 1}, '30/06/2024': {'connections': 2, 'uniq_ips': 1}}",CVE-2019-20504,2,2024-06-30 06:01:20.363331
Node.js,Node.js,True,True,2,1.0,2,68,31,{},CVE-2021-21315,18755,2026-02-07 13:05:04.199888
Wordpress,Wordpress Kubio AI Page Builder plugin,True,True,2,2.0,15,16,35,{},CVE-2025-2294,3023,2026-02-07 13:05:04.190052
Geutebruck,G-Cam/EFD-2250,True,True,2,1.0,2,2,2,"{'15/09/2024': {'connections': 2, 'uniq_ips': 1}}",CVE-2017-5173,3,2024-09-15 12:39:34.683092
sar2html,sar2html,True,True,2,1.0,5,12,12,{},CVE-2025-34030,51,2026-02-07 13:05:04.238924
OptiLink,ONT1GEW,True,True,2,1.0,96,50,50,"{'06/02/2026': {'connections': 2, 'uniq_ips': 1}}",CVE-2025-34049,48,2026-02-06 13:16:16.357240
Sangfor,Sangfor EDR,True,True,2,1.0,15,15,15,{},CVE-2025-34041,43,2026-02-06 13:16:16.386159
Alibaba,Fastjson,True,True,2,1.0,32,24,27,{},CVE-2017-18349,11452,2026-02-07 13:05:04.272409
Hikvision,Management-Platform,True,True,2,1.0,32,20,20,{},CVE-2025-34067,100,2026-02-07 13:05:04.325146
Progress,MOVEit Transfer,True,True,2,1.0,2,2,2,"{'01/07/2024': {'connections': 2, 'uniq_ips': 1}, '02/07/2024': {'connections': 2, 'uniq_ips': 1}, '07/07/2024': {'connections': 2, 'uniq_ips': 1}, '08/07/2024': {'connections': 2, 'uniq_ips': 1}, '15/07/2024': {'connections': 2, 'uniq_ips': 1}, '16/07/2024': {'connections': 2, 'uniq_ips': 1}, '21/12/2024': {'connections': 2, 'uniq_ips': 1}, '22/12/2024': {'connections': 2, 'uniq_ips': 1}, '28/07/2025': {'connections': 2, 'uniq_ips': 1}, '29/07/2025': {'connections': 2, 'uniq_ips': 1}}",CVE-2023-34362,10,2024-07-02 12:01:13.979426
vBulletin,vBulletin,True,True,2,1.0,2,2,2,{},CVE-2025-48827,2,2025-08-02 02:11:21.528574
Zhiyuan,Zhiyuan OA,True,True,2,1.0,2,3,3,{},CVE-2025-34040,8,2026-02-07 13:05:04.200090
Selea,Selea Targa IP OCR-ANPR Camera,True,True,2,1.0,2,7,7,{},CVE-2025-34022,2,2026-02-07 13:05:04.240584
Ruijie Networks,Ruijie NBR routers,True,True,2,1.0,35,43,43,"{'06/02/2026': {'connections': 2, 'uniq_ips': 1}}",CVE-2025-34057,128,2026-02-06 13:16:16.447348
HPE,HPE intelligent Management Center (iMC) PLAT,True,True,2,1.0,23,22,27,"{'06/02/2026': {'connections': 2, 'uniq_ips': 1}}",CVE-2017-8961,9594,2026-02-06 13:16:16.396215
camptocamp,Terraboard,True,True,2,1.0,2,2,2,"{'15/09/2024': {'connections': 2, 'uniq_ips': 1}}",CVE-2022-1883,3,2024-09-15 12:39:34.687628
Oracle,Oracle Fusion Middleware (Identity Manager),True,True,2,1.0,2,2,2,"{'04/12/2025': {'connections': 2, 'uniq_ips': 1}}",CVE-2025-61757,2,2025-12-04 12:59:17.574112
F5,BIG-IP,True,True,1,1.0,1,1,1,"{'05/03/2025': {'connections': 1, 'uniq_ips': 1}}",CVE-2022-41800,1,2025-03-05 12:46:38.280641
Boa,Boa,True,True,1,1.0,1,24,13,{},CVE-2017-9833,5158,2026-02-07 13:05:04.225729
D-Link,D-Link DSL-2888A,True,True,1,1.0,161,63,30,{},CVE-2020-24581,48504,2026-02-02 13:16:42.918181
Palo Alto Networks,Palo Alto Networks Expedition,True,True,1,1.0,1,1,1,"{'04/04/2025': {'connections': 1, 'uniq_ips': 1}}",CVE-2024-5910,13,2025-04-04 12:48:48.532340
Sonatype,Nexus Repository Manager,True,True,1,1.0,1,1,3,{},CVE-2020-10199,2441,2026-02-07 13:05:04.180994
Shanghai Fanwei Network Technology,Panwei e-cology,True,True,1,1.0,48,35,35,{},CVE-2025-34038,71,2026-02-07 13:05:04.361327
Dahua,Dahua Smart Park Integrated Management Platform,True,True,1,1.0,25,23,48,{},CVE-2023-7309,2023,2026-02-07 13:05:04.291436
D-Link,D-Link DSL-2730U/2750U/2750E,True,True,1,1.0,1,7,7,{},CVE-2025-34048,1,2026-02-07 13:05:04.366461
Supervisor,XML-RPC Server,True,True,1,1.0,1,2,4,{},CVE-2017-11610,4237,2026-02-07 13:05:04.207086
Atlassian,JIRA,True,True,1,1.0,1,2,21,{},CVE-2022-39960,7486,2026-02-07 13:05:04.317356
RedHat,JBoss,True,True,1,1.0,4,8,5,"{'07/01/2026': {'connections': 1, 'uniq_ips': 1}}",CVE-2017-12149,50,2026-01-07 13:00:46.884807
Progress,WS_FTP Server,True,True,1,1.0,1,1,1,"{'07/12/2025': {'connections': 1, 'uniq_ips': 1}}",CVE-2023-40044,20,2025-12-07 12:50:26.605995
Totolink,Totolink N600R,True,True,1,1.0,1,1,1,"{'20/04/2025': {'connections': 1, 'uniq_ips': 1}, '28/06/2025': {'connections': 1, 'uniq_ips': 1}, '29/06/2025': {'connections': 1, 'uniq_ips': 1}}",CVE-2022-28912,1,2025-04-20 12:43:37.112621
Western Digital,MyCloud PR4100,True,True,1,1.0,1,1,1,"{'08/01/2026': {'connections': 1, 'uniq_ips': 1}}",CVE-2017-17560,406,2026-01-08 13:01:16.033612
Ivanti,Ivanti Secure Connect and Policy Secure,True,True,1,1.0,744,210,173,{},CVE-2023-46805,39356,2026-02-07 13:05:04.367171
QNAP,QTS and QuTS Hero,True,False,1,,1,1,1,,CVE-2023-39296,1,2024-03-25 12:01:19.197225
Wordpress,Wordpress Core,True,True,1,1.0,1,1,1,"{'20/08/2025': {'connections': 1, 'uniq_ips': 1}, '22/10/2025': {'connections': 1, 'uniq_ips': 1}, '23/10/2025': {'connections': 1, 'uniq_ips': 1}, '17/12/2025': {'connections': 1, 'uniq_ips': 1}, '18/12/2025': {'connections': 1, 'uniq_ips': 1}}",CVE-2022-21661,117,2025-08-20 12:53:31.109648
Apache,Solr,True,True,1,1.0,1,8,4,"{'15/01/2026': {'connections': 1, 'uniq_ips': 1}}",CVE-2019-0193,148,2026-01-15 13:01:04.203176
PHPSHE,PHPSHE,True,True,1,1.0,2,6,7,{},CVE-2019-9762,10474,2026-02-07 13:05:04.375338
Symantec,Symantec Web Gateway 5.0.2.8,True,True,1,1.0,1,1,1,"{'01/09/2025': {'connections': 1, 'uniq_ips': 1}, '04/09/2025': {'connections': 1, 'uniq_ips': 1}, '05/09/2025': {'connections': 1, 'uniq_ips': 1}, '09/09/2025': {'connections': 1, 'uniq_ips': 1}, '10/09/2025': {'connections': 1, 'uniq_ips': 1}, '11/09/2025': {'connections': 1, 'uniq_ips': 1}, '07/11/2025': {'connections': 1, 'uniq_ips': 1}, '08/11/2025': {'connections': 1, 'uniq_ips': 1}, '17/11/2025': {'connections': 1, 'uniq_ips': 1}, '23/12/2025': {'connections': 1, 'uniq_ips': 1}, '24/12/2025': {'connections': 1, 'uniq_ips': 1}}",CVE-2012-0297,10,2025-09-01 12:53:18.090574
Netis,Netis DL4323,True,True,1,1.0,6,29,21,{},CVE-2019-20074,1750,2026-02-07 13:05:04.355133
Nagios,Nagios XI,True,True,1,1.0,3,65,31,{},CVE-2018-10737,36132,2026-02-07 13:05:04.263897
Wordpress,Wordpress Time Clock plugin and Time Clock Pro plugin,True,True,1,1.0,1,1,1,"{'09/09/2025': {'connections': 1, 'uniq_ips': 1}, '10/09/2025': {'connections': 1, 'uniq_ips': 1}}",CVE-2024-9593,1,2025-09-09 12:53:41.609131
HuangDou,HuangDou UTCMS,True,True,1,1.0,1,1,1,"{'19/02/2025': {'connections': 1, 'uniq_ips': 1}}",CVE-2024-9916,1,2025-02-19 12:41:53.439110
D-Link/TRENDnet,D-Link/TRENDnet multiple devices,True,True,1,1.0,1,1,1,"{'24/09/2024': {'connections': 1, 'uniq_ips': 1}, '27/11/2024': {'connections': 1, 'uniq_ips': 1}, '28/11/2024': {'connections': 1, 'uniq_ips': 1}, '23/06/2025': {'connections': 1, 'uniq_ips': 1}}",CVE-2015-1187,1,2024-09-24 12:45:04.005089
IBM,BigFix,True,True,1,1.0,1,1,1,"{'07/12/2025': {'connections': 1, 'uniq_ips': 1}}",CVE-2019-4061,18187,2025-12-07 12:50:26.666458
WeiPHP,WeiPHP,True,True,1,1.0,123,107,107,{},CVE-2025-34045,76,2026-02-07 13:05:04.265668
Wordpress,Wordpress Booking Calendar plugin,True,True,1,1.0,1,1,1,"{'08/01/2026': {'connections': 1, 'uniq_ips': 1}}",CVE-2022-3982,142,2026-01-08 13:01:16.139438
Oracle,Oracle E-Business Suite (Oracle Concurrent Processing),True,True,1,1.0,43,91,151,{},CVE-2025-61882,11504,2026-02-07 13:05:04.334735
Master,Master IP CAM 01,True,True,1,1.0,1,1,1,"{'01/01/2026': {'connections': 1, 'uniq_ips': 1}, '26/01/2026': {'connections': 1, 'uniq_ips': 1}}",CVE-2019-8387,68,2026-01-01 12:57:06.181969
ABUS,ABUS TVIP 20000-21150,True,True,1,1.0,1,1,1,"{'06/02/2026': {'connections': 1, 'uniq_ips': 1}}",CVE-2023-26609,3,2025-02-15 12:39:22.937327
Wordpress,Wordpress FormCraft plugin,True,True,1,1.0,1,3,4,{},CVE-2022-0591,967,2026-02-07 13:05:04.288942
Linear,eMerge E3-Series,True,True,1,1.0,1,20,14,{},CVE-2019-7254,6327,2026-02-07 13:05:04.219781
Atlassian,JIRA,True,True,1,1.0,2,2,4,{},CVE-2019-8442,2749,2026-02-07 13:05:04.302473
Oracle,GlassFish,True,True,1,1.0,1,2,4,{},CVE-2017-1000028,2168,2026-02-07 13:05:04.263699
BigAnt Software,BigAnt Server,True,True,1,1.0,1,16,12,{},CVE-2022-23347,5514,2026-02-07 13:05:04.352433
Dogtag,Dogtag - Certificate System,True,True,1,1.0,1,12,18,{},CVE-2022-2414,10527,2026-02-07 13:05:04.212978
Citrix,XenMobile Server,True,True,1,1.0,1,12,12,{},CVE-2020-8209,21902,2026-02-07 13:05:04.226929
Citrix,"Citrix ADC, Citrix Gateway, Citrix SDWAN WAN-OP",True,True,1,1.0,1,57,132,{},CVE-2020-8191,87691,2026-02-07 13:05:04.295735
Ruijie Networks,Ruijie RG-EW Series Routers,True,True,1,1.0,1,4,3,"{'07/12/2025': {'connections': 1, 'uniq_ips': 1}, '18/12/2025': {'connections': 1, 'uniq_ips': 1}, '19/12/2025': {'connections': 1, 'uniq_ips': 1}}",CVE-2021-43163,1093,2025-12-07 12:50:26.622781
TopThink,ThinkPHP3,True,True,1,1.0,1,1,1,"{'15/07/2024': {'connections': 1, 'uniq_ips': 1}, '16/07/2024': {'connections': 1, 'uniq_ips': 1}, '02/11/2024': {'connections': 1, 'uniq_ips': 1}, '03/11/2024': {'connections': 1, 'uniq_ips': 1}, '22/05/2025': {'connections': 1, 'uniq_ips': 1}, '23/05/2025': {'connections': 1, 'uniq_ips': 1}, '24/07/2025': {'connections': 1, 'uniq_ips': 1}, '25/07/2025': {'connections': 1, 'uniq_ips': 1}, '11/08/2025': {'connections': 1, 'uniq_ips': 1}, '12/08/2025': {'connections': 1, 'uniq_ips': 1}, '27/08/2025': {'connections': 1, 'uniq_ips': 1}}",CVE-2021-44892,1,2024-07-16 06:01:18.743265
D-Link,D-Link DIR-825 G1,True,True,1,1.0,1,2,3,{},CVE-2021-46442,804,2026-02-07 13:05:04.314722
D-Link,D-Link DSL-2750U,True,True,1,1.0,1,30,22,{},CVE-2021-3708,7568,2026-02-07 13:05:04.295930
Palo Alto Networks,GlobalProtect,True,True,1,1.0,1,79,225,{},CVE-2024-3400,71709,2026-02-07 13:05:04.296950
ECOA,ECOA Building Automation System,True,True,1,1.0,15,12,17,{},CVE-2021-41293,10877,2026-01-27 13:06:28.016244
Atlassian,Bitbucket,True,True,1,1.0,1,3,4,{},CVE-2022-36804,811,2026-02-07 13:05:04.266066
AfterLogic,AfterLogic Aurora/WebMail Pro,True,True,1,1.0,2,14,16,{},CVE-2021-26294,25328,2026-02-07 13:05:04.237889
Citrix,"Citrix ADC, Citrix Gateway, Citrix SDWAN WAN-OP",True,True,1,1.0,2,150,119,{},CVE-2020-8193,467759,2026-02-07 13:05:04.290830
Cisco,Cisco ASA and Cisco Firepower Threat Defense,True,True,1,1.0,2,62,143,{},CVE-2020-3452,79979,2026-02-07 13:05:04.329059
Chamilo,LMS,True,True,1,1.0,34,30,43,{},CVE-2021-34187,20298,2026-02-06 13:16:16.373582
Zoho,ManageEngine OpManager,True,True,1,1.0,1,1,1,"{'13/09/2024': {'connections': 1, 'uniq_ips': 1}, '14/09/2024': {'connections': 1, 'uniq_ips': 1}}",CVE-2021-3287,1,2024-09-13 12:40:59.449443
NSFOCUS,NSFOCUS SecGate3600 Firewall,True,True,1,1.0,1,1,1,"{'25/10/2025': {'connections': 1, 'uniq_ips': 1}, '06/12/2025': {'connections': 1, 'uniq_ips': 1}, '07/12/2025': {'connections': 1, 'uniq_ips': 1}}",CVE-2023-7308,1,2025-10-25 12:47:59.001063
VMWare,vCenter Server,True,True,1,1.0,2,2,4,{},CVE-2021-21972,2657,2026-02-07 13:05:04.190668
Technicolor,Technicolor TC7200,True,True,1,1.0,1,1,1,"{'11/11/2025': {'connections': 1, 'uniq_ips': 1}}",CVE-2014-1677,213,2025-11-11 12:54:39.728649
GLPI,GLPI,True,True,1,1.0,1,3,8,{},CVE-2021-39211,6556,2026-02-07 13:05:04.318757
Grafana,Grafana,True,True,0,0.0,0,3,20,{},CVE-2025-3415,448,2025-12-30 02:10:47.323259
Juniper,Junos OS (J-Web),True,True,0,0.0,191,128,37,{},CVE-2024-21620,511,2026-02-02 13:16:42.750757
Citrix,Citrix NetScaler ADC and NetScaler Gateway,True,True,0,0.0,2,2,2,{},CVE-2025-6543,16,2025-10-29 12:58:20.254638
Beijing NetGuard Nebula Information Technology,Leadsec VPN,True,True,0,0.0,3,13,13,{},CVE-2025-34047,68,2026-01-24 02:10:29.298348
Jenkins,Jenkins,True,True,0,0.0,0,8,13,{},CVE-2025-59474,157,2026-01-27 13:06:28.039611
Palo Alto Networks,Palo Alto Networks Expedition,True,True,0,0.0,26,31,26,{},CVE-2024-9465,7649,2026-02-02 13:16:42.776422
Langflow,Langflow,True,True,0,0.0,30,19,53,{},CVE-2025-3248,25790,2026-02-06 13:16:16.284773
David Strutz,bootstrap-multiselect,True,True,0,0.0,2,2,24,{},CVE-2025-47204,549,2026-01-27 13:06:27.995807
Invision Power Services,Invision Community,True,True,0,0.0,31,16,50,{},CVE-2025-47916,6166,2026-02-06 13:16:16.360408
Open Source SRS Community,SNS,True,True,0,0.0,24,10,14,{},CVE-2023-34105,1244,2026-01-24 02:10:29.245992
CyberPanel,CyberPanel,True,True,0,0.0,65,33,17,{},CVE-2024-32736,2329,2026-02-02 13:16:42.756762
Linksys,Linksys E2000,True,True,0,0.0,54,28,18,{},CVE-2024-27497,4032,2026-02-02 13:16:42.830181
Microsoft,SharePoint,True,True,0,0.0,736,365,284,{},CVE-2025-53770,22989,2026-02-02 13:16:42.933782
SpectoLabs,HoverFly,True,True,0,0.0,1,24,25,{},CVE-2024-45388,5032,2026-02-07 13:05:04.220585
Ruijie Networks,Ruijie BCR810W,True,True,0,0.0,0,13,67,{},CVE-2023-3608,80731,2025-10-30 12:56:29.294381
h20.ai,h20.ai Dashboard,True,True,0,0.0,10,6,23,{},CVE-2023-6038,10220,2026-01-24 02:10:29.201196
Zyxel,Zyxel NAS326/NAS540/NAS542,True,True,0,0.0,0,0,6,{},CVE-2023-27992,58,2025-04-08 12:50:16.207163
OS4ED,openSIS-Classic Version,True,True,0,0.0,0,0,80,{},CVE-2024-51211,376,2025-09-07 12:44:00.591865
Homebrew Computer Company,Jan,True,True,0,0.0,52,27,21,{},CVE-2024-36857,7835,2026-02-02 13:16:42.815281
Navidrome,Navidrome,True,True,0,0.0,0,1,3,{},CVE-2025-27112,106,2026-01-08 13:01:16.134144
Tenda,Tenda 03V2,True,True,0,0.0,342,346,339,{},CVE-2025-7414,14703,2026-01-07 02:12:33.191307
GruppoSCAI,RealGimm,True,True,0,0.0,5,3,10,{},CVE-2023-41642,2803,2026-01-07 13:00:46.896879
FastAdmin,FastAdmin,True,True,0,0.0,5,4,16,{},CVE-2024-7928,4500,2026-01-24 02:10:29.384469
Lightdash,Lightdash,True,True,0,0.0,55,37,15,{},CVE-2023-35844,4896,2026-02-02 13:16:42.950965
Draytek,Draytek Vigor2960 and Vigor300B,True,True,0,0.0,0,2,11,{},CVE-2024-12987,110,2025-07-28 12:59:31.826016
Four-Faith,Four-Faith F3x24 and F3x36,True,True,0,0.0,142,104,252,{},CVE-2024-12856,40893,2026-02-02 13:16:42.823152
i7MEDIA,mojoPortal,True,True,0,0.0,4,4,16,{},CVE-2025-28367,391,2025-12-25 12:55:51.749293
Mirko Böer Software Development,SuperWebMailer,True,True,0,0.0,1,3,18,{},CVE-2023-38192,7397,2026-01-19 13:05:33.393790
Jenkins,Jenkins,True,True,0,0.0,4,3,4,{},CVE-2024-23897,2067,2026-02-02 13:16:42.747578
Geoserver,Geoserver,True,True,0,0.0,1296,441,153,{},CVE-2025-30220,15078,2026-01-27 13:06:27.875129
Linksys,Linksys RE7000,True,True,0,0.0,8,5,27,{},CVE-2024-25852,5462,2026-01-24 02:10:29.199564
QNAP,QNAP VioStor NVR,True,True,0,0.0,0,0,3,{},CVE-2023-47565,16,2025-12-24 12:56:38.640434
Juniper,Junos OS (J-Web),True,True,0,0.0,1270,636,684,{},CVE-2023-36844,52181,2026-02-02 13:16:42.798646
Wordpress,Wordpress Ditty plugin,True,True,0,0.0,14,19,16,{},CVE-2025-8085,163,2026-02-02 13:16:42.741384
Wazuh,Wazuh,True,True,0,0.0,0,381,193,{},CVE-2025-24016,5749,2026-02-02 13:16:42.814448
Fujian Apex Software,LiveBOS,True,True,0,0.0,4,4,3,{},CVE-2024-13981,1,2026-01-24 02:10:29.405441
Ghost,Ghost,True,True,0,0.0,0,4,18,{},CVE-2023-32235,9076,2026-01-19 13:05:33.250834
Gradio,Gradio,True,True,0,0.0,21,12,35,{},CVE-2024-1561,34522,2026-01-24 02:10:29.398742
Stirling Tools,Stirling-PDF,True,True,0,0.0,29,29,37,{},CVE-2025-55161,858,2026-01-20 13:06:03.909184
Splunk,Splunk Enterprise on Windows,True,True,0,0.0,0,6,10,{},CVE-2024-36991,159,2025-10-10 12:51:58.451692
Dasan,Dasan GPON ONT WiFi Router H640X,True,True,0,0.0,0,0,46,{},CVE-2017-18046,198,2025-09-18 12:52:11.737042
PrestaShop,PrestaShop jmsblog,True,True,0,0.0,0,2,2,{},CVE-2023-27034,2063,2025-03-26 12:49:20.263192
ChanCMS,ChanCMS,True,True,0,0.0,1,1,1,{},CVE-2025-10211,0,2026-02-02 13:16:42.827094
Wordpress,Wordpress Likes and Dislikes plugin,True,True,0,0.0,45,45,40,{},CVE-2025-5287,1122,2026-01-20 13:06:03.838320
JetBrains,TeamCity,True,True,0,0.0,94,44,834,{},CVE-2024-27199,131047,2026-02-02 13:16:42.887173
Adobe,Adobe Experience Manager,True,True,0,0.0,0,0,6,{},CVE-2025-54254,42,2025-11-26 12:57:21.312431
ipTIME,ipTIME A2004,True,True,0,0.0,0,6,18,{},CVE-2024-54763,528,2026-01-18 12:54:10.747582
PTZOptics,PTZOptics PT30X-SDI/NDI-xx,True,True,0,0.0,2,2,2,{},CVE-2024-8957,17,2025-11-21 12:53:31.622076
Anyscale,Ray,True,True,0,0.0,610,1016,407,{},CVE-2023-48022,16806,2026-02-02 13:16:42.924278
Guangzhou Yingke Electronic Technology,Ncast,True,True,0,0.0,19,12,31,{},CVE-2024-0305,17881,2026-01-24 02:10:29.292121
SysAid,SysAid On-Premise,True,True,0,0.0,38,17,20,{},CVE-2025-2775,2288,2026-02-06 13:16:16.375822
Letta,Letta,True,True,0,0.0,0,0,6,{},CVE-2025-51482,8,2026-01-24 02:10:29.346744
Qianxin,TianQing Management Center,True,True,0,0.0,0,0,14,{},CVE-2024-13984,28,2026-01-24 02:10:29.209038
GFI,Kerio Control,True,True,0,0.0,103,52,30,{},CVE-2024-52875,13603,2026-02-02 13:16:42.882859
Wordpress,Wordpress Backup Migration plugin,True,True,0,0.0,0,4,23,{},CVE-2023-6553,167,2025-12-17 12:59:56.283190
White Star Software,White Star Software Potop,True,True,0,0.0,47,47,42,{},CVE-2025-44177,1133,2026-01-20 13:06:03.838122
Commvault,Commvault Command Center,True,True,0,0.0,37,17,27,{},CVE-2025-34028,3467,2026-02-06 13:16:16.331765
Apache,Struts,True,True,0,0.0,5,9,23,{},CVE-2017-5638,12078,2026-02-02 13:16:42.740924
Apache,Tomcat,True,True,0,0.0,9,8,140,{},CVE-2025-24813,8634,2026-02-06 13:16:16.432290
Selea,Targa IP OCR-ANPR Camera,True,True,0,0.0,15,51,51,{},CVE-2025-34021,87,2026-02-02 13:16:42.858662
ETQ,ETQ Reliance,True,True,0,0.0,20,13,44,{},CVE-2025-34143,2373,2026-02-06 13:16:16.305447
Grafana,Grafana,True,True,0,0.0,250,250,115,{},CVE-2025-4123,4440,2026-01-20 13:06:03.820792
Wordpress,Wordpress Extensive VC Addons for WPBakery page builder plugin,True,True,0,0.0,26,13,20,{},CVE-2023-0159,1321,2026-01-24 02:10:29.306302
HPE,HPE OneView,True,True,0,0.0,3,30,30,{},CVE-2025-37164,230,2026-01-27 13:06:28.008311
Wordpress,Wordpress EventON plugin,True,True,0,0.0,2,2,18,{},CVE-2024-0235,642,2026-01-24 02:10:29.226826
Odoo,Odoo,True,True,0,0.0,0,18,19,{},CVE-2023-1434,8286,2026-02-06 13:16:16.331950
Next.js,Next.js,True,True,0,0.0,0,1,1,{},CVE-2025-29927,50,2026-01-13 13:02:28.172196
Rocket.Chat,Rocket.Chat,True,True,0,0.0,10,17,21,{},CVE-2024-39713,5577,2026-02-02 13:16:42.801863
Uniview,Uniview ISC 2500-S,True,True,0,0.0,26,24,29,{},CVE-2024-0778,3093,2025-07-30 12:59:56.420884
SecurePoint,SecurePoint UTM,True,True,0,0.0,2,3,13,{},CVE-2023-22897,6833,2026-01-24 02:10:29.319460
Landray,Landray EKP,True,True,0,0.0,7,13,14,{},CVE-2024-11238,812,2026-02-06 13:16:16.333283
Karel,Karel IP Phone IP1211,True,True,0,0.0,2,14,14,{},CVE-2025-34023,50,2026-01-24 02:10:29.258133
CyberPanel,CyberPanel,True,True,0,0.0,51,26,18,{},CVE-2024-32737,2111,2026-02-02 13:16:42.767960
Totolink,Totolink A950RG,True,True,0,0.0,0,0,106,{},CVE-2025-28036,303,2025-10-12 12:45:43.494336
Wordpress,Wordpress Registration Forms plugin,True,True,0,0.0,0,4,19,{},CVE-2023-0552,4835,2026-01-18 12:54:10.761298
CrushFTP,CrushFTP,True,True,0,0.0,87,58,32,{},CVE-2023-43177,3319,2026-01-24 02:10:29.264516
Wordpress,Wordpress WP Job Portal plugin,True,True,0,0.0,30,14,23,{},CVE-2023-4490,1730,2026-01-24 02:10:29.253402
SolarWinds,SolarWinds Security Event Manager,True,True,0,0.0,27,15,36,{},CVE-2024-0692,1453,2026-01-24 02:10:29.252550
Unit4,Unit4 Financials by Coda,True,True,0,0.0,0,4,25,{},CVE-2024-28734,7936,2026-01-07 13:00:46.863073
LiteLLM,LiteLLM,True,True,0,0.0,23,12,19,{},CVE-2024-6587,4628,2026-01-24 02:10:29.249898
SecurePoint,SecurePoint UTM,True,True,0,0.0,15,7,19,{},CVE-2023-22620,9921,2026-01-20 13:06:03.863284
CyberPanel,CyberPanel,True,True,0,0.0,66,45,20,{},CVE-2024-32739,2228,2026-02-02 13:16:42.810265
MasterSAM,MasterSAM Star Gate,True,True,0,0.0,53,27,17,{},CVE-2024-55457,822,2026-02-02 13:16:42.926479
Zivif,Zivif PR115-204-P-RS,True,True,0,0.0,0,199,299,{},CVE-2017-17105,8839,2026-01-18 12:54:10.843066
Totolink,Totolink EX1800T,True,True,0,0.0,22,12,31,{},CVE-2024-34257,7478,2026-01-24 02:10:29.394951
Yaws,Yaws,True,True,0,0.0,49,25,42,{},CVE-2017-10974,5390,2026-02-02 13:16:42.869115
ReadtoMyShoe,ReadtoMyShoe,True,True,0,0.0,1,3,21,{},CVE-2023-27587,4221,2026-01-19 13:05:33.414263
QNAP,"QNAP QTS, QuTSCloud, QuTS Hero",True,True,0,0.0,0,8,8,{},CVE-2024-27130,12,2024-09-01 12:01:11.467420
SugarCRM,SugarCRM,True,True,0,0.0,0,0,1,{},CVE-2023-22952,699,2025-11-29 12:51:05.941428
Adobe,ColdFusion,True,True,0,0.0,5,29,23,{},CVE-2023-29298,15985,2026-02-07 13:05:04.372841
F-Logic,DataCube3,True,True,0,0.0,22,12,27,{},CVE-2024-31750,6816,2026-01-20 13:06:03.859521
Sitecore,"Sitecore Experience Manager (XM), Experience Platform (XP), Experience Commerce (XC)",True,True,0,0.0,2,25,28,{},CVE-2025-34509,218,2026-01-27 13:06:28.037837
Totolink,Totolink A3300R,True,True,0,0.0,0,0,59,{},CVE-2024-24329,354,2025-05-14 12:52:06.374541
Gradio,Gradio,True,True,0,0.0,20,12,31,{},CVE-2024-4325,6627,2026-01-24 02:10:29.211159
Erudika,Scoold,True,True,0,0.0,6,4,24,{},CVE-2024-50334,778,2026-01-05 02:29:32.052158
NAKIVO,NAKIVO Backup & Replication,True,True,0,0.0,21,23,29,{},CVE-2024-48248,5789,2026-02-02 13:16:42.882190
Journeyx,Journeyx,True,True,0,0.0,23,12,22,{},CVE-2024-6893,5687,2026-01-24 02:10:29.214520
Atlassian,JIRA STAGIL Navigation for Jira - Menu & Themes plugin,True,True,0,0.0,52,18,111,{},CVE-2023-26255,15415,2026-02-02 13:16:42.755612
Citrix,Citrix Virtual Apps and Desktops,True,True,0,0.0,15,15,12,{},CVE-2024-8069,4631,2026-02-02 13:16:42.796423
Atlassian,JIRA STAGIL Navigation for Jira - Menu & Themes plugin,True,True,0,0.0,61,25,377,{},CVE-2023-26256,22527,2026-02-02 13:16:42.769488
TVT/Provision-ISR,Multiple DVR models,True,True,0,0.0,12,7,124,{},CVE-2024-7339,12427,2025-12-24 12:56:38.767809
Lexmark,Lexmark,True,True,0,0.0,14,8,17,{},CVE-2023-26067,8911,2026-01-20 13:06:03.907769
SimpleHelp,SimpleHelp,True,True,0,0.0,0,0,9,{},CVE-2024-57727,39,2025-05-06 12:52:58.628769
DataEase,DataEase,True,True,0,0.0,0,5,20,{},CVE-2024-30269,599,2026-01-19 13:05:33.236318
Wordpress,Wordpress Duplicator/Duplicator Pro plugin,True,True,0,0.0,109,45,37,{},CVE-2023-6114,26409,2026-02-02 13:16:42.738008
Alkacon,OpenCms,True,True,0,0.0,31,13,23,{},CVE-2023-42344,10163,2026-01-24 02:10:29.393566
QNAP,QNAP QTS and QuTS Hero,True,True,0,0.0,1,11,21,{},CVE-2023-47218,29741,2026-01-20 13:06:03.840276
PHP Foundation,PHP (PHP-CGI),True,True,0,0.0,41,49,34,{},CVE-2024-4577,243428,2026-02-02 13:16:42.748109
Citrix,Citrix NetScaler ADC and NetScaler Gateway,True,True,0,0.0,0,0,353,{},CVE-2023-6549,3861,2025-10-01 12:55:46.317996
Netis,Netis MW5360,True,True,0,0.0,0,0,1297,{},CVE-2024-22729,7617,2024-09-26 12:45:15.493387
pyLoad,pyLoad,True,True,0,0.0,0,1,39,{},CVE-2023-0297,876,2025-11-18 12:55:38.631576
Appwrite,Appwrite,True,True,0,0.0,204,103,32,{},CVE-2023-27159,15070,2026-02-02 13:16:42.769917
Ivanti,"Ivanti Connect Secure, Policy Secure and ZTA",True,True,0,0.0,6,16,24,{},CVE-2024-22024,27181,2026-02-02 13:16:42.814002
ConnectWise,ScreenConnect,True,True,0,0.0,13,302,129,{},CVE-2024-1709,125879,2026-02-06 13:16:16.424538
RAISECOM,"RAISECOM MSG1200, MSG2100E, MSG2200 and MSG2300",True,True,0,0.0,10,6,25,{},CVE-2024-7120,13373,2026-01-05 02:29:32.100872
APsystems,Altenergy Power Control Software,True,True,0,0.0,1,43,21,{},CVE-2024-11305,11588,2025-12-16 13:00:01.499472
Zyxel,Zyxel DX5401-B0,True,True,0,0.0,68,28,27,{},CVE-2023-28770,5866,2026-02-02 13:16:42.816559
metersphere,metersphere,True,True,0,0.0,17,9,17,{},CVE-2023-25573,10478,2026-01-24 02:10:29.384886
Sangfor,Sangfor Behavior Management System (DC Management System),True,True,0,0.0,4,4,4,{},CVE-2023-7307,1,2026-01-24 02:10:29.297925
Totolink,Totolink A3300R,True,True,0,0.0,0,0,59,{},CVE-2024-24328,353,2025-05-14 12:52:06.399727
Adobe,ColdFusion,True,True,0,0.0,54,19,17,{},CVE-2023-38205,9087,2026-02-02 13:16:42.939531
Apache,OFBiz,True,True,0,0.0,1,1,1,{},CVE-2024-32113,2981,2025-04-15 12:50:19.614429
Adobe,Adobe Commerce and Magento Open Source,True,True,0,0.0,0,0,7,{},CVE-2024-34102,60,2025-10-20 02:05:45.047798
Parsec Automation,TrackSYS,True,True,0,0.0,1,2,21,{},CVE-2024-6188,5131,2025-12-24 12:56:38.791952
Totolink,Totolink X18,True,True,0,0.0,0,3,48,{},CVE-2024-2353,1955,2026-01-01 12:57:06.292943
BYTEVALUE,BYTEVALUE Intelligent Flow Control Router,True,True,0,0.0,77,123,257,{},CVE-2023-7311,8076,2026-01-24 02:10:29.323948
Citrix,Citrix StoreFront,True,True,0,0.0,1,9,19,{},CVE-2023-5914,21277,2026-01-19 13:05:33.386524
Fortinet,FortiOS and FortiProxy,True,True,0,0.0,0,0,9,{},CVE-2024-21762,186,2026-01-10 02:09:33.574621
Apache,HugeGraph,True,True,0,0.0,253,96,41,{},CVE-2024-27348,7882,2026-02-06 13:16:16.403193
GeoVision,GeoVision multiple EOL products,True,True,0,0.0,0,33,64,{},CVE-2024-11120,2300,2026-01-15 13:01:04.276175
QNAP,QNAP QTS and QuTS Hero,True,True,0,0.0,0,0,600,{},CVE-2023-50358,15985,2026-01-27 13:06:27.941309
Netis,Netis routers multiple models,True,True,0,0.0,6,25,69,{},CVE-2024-48455,13876,2026-02-07 13:05:04.183803
QNAP,QNAP QTS and QuTS Hero,True,True,0,0.0,0,8,4,{},CVE-2024-21899,181286,2026-01-11 12:55:34.170160
Ruckus,Ruckus Wireless Admin,True,True,0,0.0,1,1,28,{},CVE-2023-25717,390,2025-06-24 12:54:48.744665
Citrix,Citrix Session Recording,True,True,0,0.0,0,0,7,{},CVE-2023-6184,64,2025-10-20 02:05:45.118293
CrushFTP,CrushFTP,True,True,0,0.0,78,52,100,{},CVE-2024-4040,16739,2026-01-24 02:10:29.205993
IBM,IBM Operational Decision Manager,True,True,0,0.0,208,208,83,{},CVE-2024-22320,6772,2026-02-02 13:16:42.871776
Totolink,Totolink N200RE,True,True,0,0.0,0,0,200,{},CVE-2024-0297,585,2025-10-12 12:45:43.455852
Totolink,Totolink LR1200GB,True,True,0,0.0,0,0,102,{},CVE-2024-0292,297,2025-10-12 12:45:43.469889
CyberPanel,CyberPanel,True,True,0,0.0,50,21,18,{},CVE-2024-32738,2344,2026-02-02 13:16:42.873650
Chamilo,Chamilo,True,True,0,0.0,1,3,17,{},CVE-2023-4220,3916,2026-01-19 13:05:33.398149
Request Baskets,Request Baskets,True,True,0,0.0,1,3,17,{},CVE-2023-27163,500,2026-01-19 13:05:33.330441
Citrix,Citrix ShareFile StorageZones (aka storage zones) Controller,True,True,0,0.0,0,0,308,{},CVE-2023-24489,308,2024-11-22 12:46:11.288355
Adobe,ColdFusion,True,True,0,0.0,4,11,22,{},CVE-2024-20767,8986,2026-02-02 13:16:42.801373
Wordpress,Wordpress EventON plugin,True,True,0,0.0,0,4,19,{},CVE-2023-2796,5259,2026-01-19 13:05:33.357836
Citrix,Citrix ADC and Citrix Gateway,True,True,0,0.0,6068,2983,3544,{},CVE-2023-24488,1136210,2026-02-07 13:05:04.342374
ServiceNow,"Now Platform (Washington DC, Vancouver, and earlier releases)",True,True,0,0.0,0,6,2,{},CVE-2024-5217,1570,2025-12-30 12:58:50.781654
F-Logic,DataCube3,True,True,0,0.0,0,0,80,{},CVE-2024-34854,376,2025-09-07 12:44:00.484046
Changsha SPON Communication Technology,SPON IP Network Broadcast System,True,True,0,0.0,1,2,3,{},CVE-2024-13982,38,2026-01-18 12:54:10.786028
FileMage,FileMage Gateway,True,True,0,0.0,52,22,21,{},CVE-2023-39026,4806,2026-02-02 13:16:42.850280
Wordpress,Wordpress Debug Tool plugin,True,True,0,0.0,0,0,7,{},CVE-2024-10586,87,2025-10-24 12:54:46.719501
dirk1983,chatgpt,True,True,0,0.0,54,27,19,{},CVE-2024-27564,5091,2026-02-02 13:16:42.903115
Gargoyle,Gargoyle Router,True,True,0,0.0,265,265,265,{},CVE-2015-10145,0,2026-02-02 13:16:42.825400
Kaseya,VSA,True,True,0,0.0,0,4,21,{},CVE-2015-2863,6559,2026-01-19 13:05:33.384129
"Open Source Matters, Inc/Joomla community",Joomla,False,False,0,,0,6,3,,CVE-2015-8562,0,2024-03-12 10:43:50.926597
NextChat (ChatGPT-Next-Web),NextChat (ChatGPT-Next-Web),True,True,0,0.0,57,28,82,{},CVE-2024-38514,11549,2026-01-20 13:06:03.847801
Four-Faith,Four-Faith F3x36,True,True,0,0.0,0,24,367,{},CVE-2024-9644,10129,2025-12-13 12:52:24.099051
Samsung,Samsung magicINFO 9,True,True,0,0.0,32,278,215,{},CVE-2024-7399,18120,2026-02-02 13:16:42.752947
Elastic,Elasticsearch,True,True,0,0.0,41,55,36,{},CVE-2015-1427,66424,2026-02-07 13:05:04.380460
Ivanti,"Ivanti Connect Secure, Policy Secure and Ivanti Neurons for ZTA",True,True,0,0.0,28,16,24,{},CVE-2024-21893,47160,2026-01-27 13:06:27.962245
Korenix,"Jetwave 4200, Jetwave 3000 Series",True,True,0,0.0,0,0,83,{},CVE-2023-23295,611,2025-10-30 12:56:29.146812
Homebrew Computer Company,Jan,True,True,0,0.0,56,29,21,{},CVE-2024-36858,8018,2026-02-02 13:16:42.804985
OpenAPI Tools,OpenAPI Generator,True,True,0,0.0,15,16,25,{},CVE-2024-35219,6810,2026-02-02 13:16:42.865114
ipTIME,ipTIME A2004,True,True,0,0.0,2,4,15,{},CVE-2024-54764,528,2026-01-24 02:10:29.405655
Hangzhou Kuozhi Network Technology,EduSoho,True,True,0,0.0,7,7,7,{},CVE-2023-7335,0,2026-01-27 13:06:27.995652
Zyxel,Zyxel NAS326/NAS542,True,True,0,0.0,0,0,317,{},CVE-2023-4473,708,2024-07-28 06:01:26.179100
Oracle,Oracle E-Business Suite,True,True,0,0.0,10,6,25,{},CVE-2016-0457,22124,2026-01-07 02:12:33.174346
WebIQ,WebIQ,True,True,0,0.0,1,3,30,{},CVE-2024-8752,5227,2026-01-18 12:54:10.873465
PrestaShop,PrestaShop tshirtecommerce,True,True,0,0.0,51,26,18,{},CVE-2023-27640,4440,2026-02-02 13:16:42.900622
Zyxel,nan,True,True,0,0.0,193,457,385,{},CVE-2023-28771,426198,2026-01-07 02:12:33.090856
DigiEver,DigiEver DS-2105 Pro,True,True,0,0.0,160,249,445,{},CVE-2023-52163,30347,2026-01-12 13:02:45.708783
Sitecore,"Sitecore Experience Manager (XM), Experience Platform (XP), Experience",True,True,0,0.0,0,28,29,{},CVE-2024-46938,774,2025-11-26 12:57:21.121029
Cisco,Cisco Finesse,True,True,0,0.0,42,42,42,{},CVE-2024-20404,0,2026-02-06 13:16:16.385183
GL.iNet,GL.iNet devices,True,True,0,0.0,5,21,15,{},CVE-2023-31478,4138,2026-02-07 13:05:04.236429
AVTECH,AVTECH IP camera,True,True,0,0.0,22,12,25,{},CVE-2024-7029,10584,2026-01-24 02:10:29.257284
FlowiseAI,Flowise,True,True,0,0.0,5,25,25,{},CVE-2024-8181,10887,2026-02-07 13:05:04.235423
ABB,"ABB ASPECT-Enterprise on Linux, ABB NEXUS Series on Linux, ABB MATRIX Series on Linux",True,True,0,0.0,0,0,43,{},CVE-2024-6298,95,2025-05-04 12:46:29.885961
Hot-World GmbH,Repetier Server,True,True,0,0.0,0,24,12,{},CVE-2023-31059,2596,2026-02-06 13:16:16.399431
Fortra,GoAnywhere MFT,True,True,0,0.0,22,13,912,{},CVE-2023-0669,6325243,2026-01-20 13:06:03.800789
Cellinx,Cellinx NVT Camera,True,True,0,0.0,0,0,84,{},CVE-2023-23063,401,2025-09-07 12:44:00.550528
Netentsec,NS-ASG Application Security Gateway,True,True,0,0.0,6,3,22,{},CVE-2024-2330,3249,2026-01-05 02:29:32.240116
VertaAI,ModelDB,True,True,0,0.0,6,35,15,{},CVE-2023-6023,8184,2026-02-07 13:05:04.303474
WSO2,"WSO2 API Manager, WSO2 Identity Server, WSO2 Identity Server as Key Manager",True,True,0,0.0,10,6,26,{},CVE-2024-7097,7741,2025-12-24 12:56:38.794285
Juniper,Junos OS (J-Web),True,True,0,0.0,12,12,1254,{},CVE-2023-36845,13243,2026-02-02 13:16:42.897333
Fujitsu,"Fujitsu Real-time Video Transmission Gear \""IP series\""",True,True,0,0.0,17,9,22,{},CVE-2023-38433,1313,2026-01-20 13:06:03.844959
RudderStack,Rudder Server,True,True,0,0.0,4,5,17,{},CVE-2023-30625,8206,2025-12-21 12:52:59.984809
Intelbras,Intelbras Switch SG 2404 MR,True,True,0,0.0,5,35,25,{},CVE-2023-36144,1650,2026-02-07 13:05:04.321916
Citrix,Citrix ADC and Citrix Gateway,True,True,0,0.0,14,8,4,{},CVE-2023-3519,317,2026-01-24 02:10:29.272032
Ivanti,Sentry,True,True,0,0.0,2,129,97,{},CVE-2023-38035,5383,2026-02-07 13:05:04.365921
FIT2CLOUD,KubePi,True,True,0,0.0,5,18,16,{},CVE-2023-22478,16762,2026-02-07 13:05:04.184421
Wordpress,Wordpress SoftLab Integrate Google Drive,True,True,0,0.0,33,33,33,{},CVE-2023-32117,48,2026-02-02 13:16:42.840861
Rebuild,Rebuild,True,True,0,0.0,0,0,17,{},CVE-2024-1021,473,2026-02-06 13:16:16.313041
Ivanti,Avalanche,True,True,0,0.0,37,22,26,{},CVE-2024-38653,7290,2026-01-24 02:10:29.248140
Ruijie,Ruijie RG-EW1200G,True,True,0,0.0,19,10,20,{},CVE-2023-4169,8559,2026-01-24 02:10:29.258328
Amcrest,Amcrest IPM-721S,True,True,0,0.0,3,45,94,{},CVE-2017-8226,21567,2026-02-02 13:16:42.865409
Geoserver,Geoserver,True,True,0,0.0,123,782,677,{},CVE-2025-58360,23654,2026-02-06 13:16:16.349559
Apache,Airflow,True,True,0,0.0,235,58,33,{},CVE-2020-11978,61819,2026-02-02 13:16:42.863384
SonicWall,SonicWall Secure Remote Access,True,True,0,0.0,113,32,12,{},CVE-2021-20028,4943,2026-02-02 13:16:42.928925
UDP Technology,video camera firmware for multiple vendors,True,True,0,0.0,17,42,60,{},CVE-2021-33544,62765,2026-02-02 13:16:42.826423
node-red-contrib-huemagic,node-red-contrib-huemagic (for Philips HUE,True,True,0,0.0,53,28,12,{},CVE-2021-25864,4630,2026-02-02 13:16:42.848093
Apache,Flink,True,True,0,0.0,192,46,30,{},CVE-2020-17518,46642,2026-02-02 13:16:42.937230
Wordpress,Wordpress Adning Advertising plugin,True,True,0,0.0,2,4,17,{},CVE-2020-36728,311,2026-01-19 13:05:33.406369
HiSilicon,HiSilicon based hardware video encoders (multiple vendors),True,True,0,0.0,3,3,3,{},CVE-2020-24219,0,2026-02-06 13:16:16.316286
D-Link,D-Link DIR-610,True,True,0,0.0,311,175,89,{},CVE-2020-9377,3563,2026-02-02 13:16:42.866195
Atlassian,JIRA,True,True,0,0.0,10,5,5,{},CVE-2021-26086,18378,2026-01-18 12:54:10.888888
Terramaster,TOS,True,True,0,0.0,2,6,29,{},CVE-2020-28185,46682,2026-01-19 13:05:33.416994
Revive,Revive Adserver,True,True,0,0.0,0,4,22,{},CVE-2020-8115,6330,2026-01-07 13:00:47.006140
Spring,Spring Cloud Netflix,True,True,0,0.0,215,87,47,{},CVE-2021-22053,39199,2026-02-02 13:16:42.943611
Totolink,A720R,True,True,0,0.0,200,141,56,{},CVE-2021-35327,2402,2024-08-08 06:01:09.766686
Apache,OFBiz,True,True,0,0.0,3,4,18,{},CVE-2020-1943,6948,2026-01-02 12:56:28.010317
PHP-Fusion,PHP-Fusion,True,True,0,0.0,60,25,360,{},CVE-2020-24949,7887,2026-02-02 13:16:42.951630
NETGEAR,RAX43,True,True,0,0.0,38,24,22,{},CVE-2021-20166,31931,2026-02-02 13:16:42.842201
Micro Focus,Operation Bridge Manager UCMDB,True,True,0,0.0,39,23,31,{},CVE-2020-11854,5874,2026-02-02 13:16:42.768390
SolarWinds,SolarWinds Web Help Desk,True,True,0,0.0,0,0,7,{},CVE-2021-35232,33,2025-11-12 12:56:37.435318
Hongdian,Hongdian H8922,True,True,0,0.0,6,5,27,{},CVE-2021-28150,1384,2026-01-24 02:10:29.346300
QCubed,QCubed,True,True,0,0.0,2,5,44,{},CVE-2020-24914,96006,2026-02-02 13:16:42.787663
